title,link,published,source,pub_date
Mesoscale functional organization of face and body areas in the macaque brain,https://www.nature.com/articles/s41467-025-63962-6,2025-10-06 00:00:00,Nature Communications,2025-10-06 00:00:00+00:00
The materials we make don’t just go ‘away’,https://www.nature.com/articles/s41578-025-00845-8,2025-10-06 00:00:00,Nature Reviews Materials,2025-10-06 00:00:00+00:00
From fossil fuels to ‘green capitalism’: the dilemmas of a just energy transition,https://www.nature.com/articles/d41586-025-03224-z,2025-10-06 00:00:00,Nature,2025-10-06 00:00:00+00:00
Volunteer scientists work ‘nights and weekends’ to guide vaccine advice in US,https://www.nature.com/articles/d41586-025-03181-7,2025-10-06 00:00:00,Nature,2025-10-06 00:00:00+00:00
Publisher Correction: Strategizing renewable energy transitions to preserve sediment transport integrity,https://www.nature.com/articles/s41893-025-01673-y,2025-10-06 00:00:00,Nature Sustainability,2025-10-06 00:00:00+00:00
"Wonder, empathy, life: why we called our pregnancy-diagnostic company Mirvie",https://www.nature.com/articles/d41586-025-02669-6,2025-10-06 00:00:00,Nature,2025-10-06 00:00:00+00:00
Will AI ever win its own Nobel? Some predict a prize-worthy science discovery soon,https://www.nature.com/articles/d41586-025-03223-0,2025-10-06 00:00:00,Nature,2025-10-06 00:00:00+00:00
The cutting-edge medical approaches that could transform ageing,https://www.nature.com/articles/d41586-025-03225-y,2025-10-06 00:00:00,Nature,2025-10-06 00:00:00+00:00
Jane Goodall obituary: pioneer primatologist who inspired generations of scientists,https://www.nature.com/articles/d41586-025-03227-w,2025-10-06 00:00:00,Nature,2025-10-06 00:00:00+00:00
A call to elevate the role of processing in AI-driven materials design,https://www.nature.com/articles/s41578-025-00846-7,2025-10-06 00:00:00,Nature Reviews Materials,2025-10-06 00:00:00+00:00
27 things we wish we’d known when we started our PhDs,https://www.nature.com/articles/d41586-025-03229-8,2025-10-06 00:00:00,Nature,2025-10-06 00:00:00+00:00
Spatially resolved reaction environments in mechanochemical upcycling of polymers,https://www.cell.com/chem/fulltext/S2451-9294(25)00345-6?rss=yes,2025-10-06 00:00:00,Chem,2025-10-06 00:00:00+00:00
Dinickel-catalyzed enantioselective reductive addition of imines with vinyl halides,https://www.nature.com/articles/s41467-025-63940-y,2025-10-06 00:00:00,Nature Communications,2025-10-06 00:00:00+00:00
Neutralizing and binding antibodies are a correlate of risk of COVID-19 in the CoVPN 3008 study in people with HIV,https://www.nature.com/articles/s41467-025-63948-4,2025-10-06 00:00:00,Nature Communications,2025-10-06 00:00:00+00:00
t<sub>2</sub> occupancy as a descriptor for polysulfide conversion on spinel oxides,https://www.nature.com/articles/s41467-025-63903-3,2025-10-06 00:00:00,Nature Communications,2025-10-06 00:00:00+00:00
Archean rifts and triple-junctions revealed by gravity modeling of the southern Superior Craton,https://www.nature.com/articles/s41467-025-63931-z,2025-10-06 00:00:00,Nature Communications,2025-10-06 00:00:00+00:00
citrOgen: a synthesis-free polysaccharide and protein antigen-presentation to antibody-induction platform,https://www.nature.com/articles/s41467-025-63922-0,2025-10-06 00:00:00,Nature Communications,2025-10-06 00:00:00+00:00
Interfacial design strategies for stable and high-performance perovskite/silicon tandem solar cells on industrial silicon cells,https://www.nature.com/articles/s41467-025-64467-y,2025-10-06 00:00:00,Nature Communications,2025-10-06 00:00:00+00:00
Late-stage direct double borylation of B/N-based multi-resonance framework enables high-performance ultra-narrowband deep-blue organic light-emitting diodes,https://www.nature.com/articles/s41467-025-63908-y,2025-10-06 00:00:00,Nature Communications,2025-10-06 00:00:00+00:00
Connecting the dots: I trace the history of the East Kolkata Wetlands,https://www.nature.com/articles/d41586-025-03231-0,2025-10-06 00:00:00,Nature,2025-10-06 00:00:00+00:00
Enantioconvergent radical addition of racemic alkyl halides to access vicinal stereocentres,https://www.nature.com/articles/s41557-025-01967-w,2025-10-06 00:00:00,Nature Chemistry,2025-10-06 00:00:00+00:00
Medicine Nobel goes to scientists who revealed secrets of immune system ‘regulation’,https://www.nature.com/articles/d41586-025-03193-3,2025-10-06 00:00:00,Nature,2025-10-06 00:00:00+00:00
Triplet state reactivity of iminium ions in organocatalytic asymmetric [2 + 2] photocycloadditions,https://www.nature.com/articles/s41557-025-01960-3,2025-10-06 00:00:00,Nature Chemistry,2025-10-06 00:00:00+00:00
Waste heat is mostly a waste of time,https://www.cell.com/joule/fulltext/S2542-4351(25)00338-1?rss=yes,2025-10-06 00:00:00,Joule,2025-10-06 00:00:00+00:00
Unlocking red-to-near-infrared luminescence via ion-pair assembly in carbodicarbene borenium ions,https://www.nature.com/articles/s41557-025-01941-6,2025-10-06 00:00:00,Nature Chemistry,2025-10-06 00:00:00+00:00
Asia: Carbon Capture and Storage plan could raise emissions by 25bn tonnes - Asia Insurance Review,https://news.google.com/rss/articles/CBMi7gFBVV95cUxQWWU1RnRLRENkTE9ObUJJOW5iV3BDeGN0SGV1NnFXUExfekFBTWNvek0tVWtpWDRXVEd1RGhFUE9jUzJ2MUlLb0NEZ09xZFNDdDFnZ0NMeE50Qml5Zlh3Q3pKTW9rSWtnbHpXX0xfRzRPUEdieEV4QmRVTVFLa1QzTUpCdkJKQU5qYnI2V2VzdS1wYU4wVktDMXYyUW9Xa3B6cXdocFpnR3dkVVVhZ3lHbnpjX0JqdDh1cnhpWGRXT1pnS1VMUmhIY2JVUVU1UUNLcXp0UENGZndOTlJ0Q29HUTh4Z050V2huZlM5U3B3?oc=5,2025-10-06 00:00:04,"""carbon capture OR CO2 storage"" - Google News",2025-10-06 00:00:04+00:00
The true cost of cyber attacks - and the business weak spots that allow them to happen,https://www.bbc.com/news/articles/c5ye8zj5l4jo?at_medium=RSS&at_campaign=rss,2025-10-06 00:52:33,BBC News,2025-10-06 00:52:33+00:00
Why are Lead Iodide‐Based Perovskite Precursor Inks Yellow?,https://advanced.onlinelibrary.wiley.com/doi/10.1002/aenm.202502813?af=R,2025-10-06 04:15:15,Wiley: Advanced Energy Materials: Table of Contents,2025-10-06 04:15:15+00:00
Suppressed Concentration Quenching Via Divalent Eu/Sr Alloying in Hybrid Iodides Scintillators Toward Bright Luminescence for X‐ray Imaging,https://onlinelibrary.wiley.com/doi/10.1002/anie.202514331?af=R,2025-10-06 04:16:09,Wiley: Angewandte Chemie International Edition: Table of Contents,2025-10-06 04:16:09+00:00
Do Micropower Sources Meet the Needs of the Internet of Things?,https://advanced.onlinelibrary.wiley.com/doi/10.1002/aenm.202503921?af=R,2025-10-06 04:16:23,Wiley: Advanced Energy Materials: Table of Contents,2025-10-06 04:16:23+00:00
Driving Multi‐Step Regioselectivity in On‐Surface Polymer Synthesis by Molecular Coverage,https://onlinelibrary.wiley.com/doi/10.1002/anie.202512575?af=R,2025-10-06 04:17:32,Wiley: Angewandte Chemie International Edition: Table of Contents,2025-10-06 04:17:32+00:00
Room‐Temperature Single Li+ Ion Conducting Organic Solid‐State Electrolyte with 10−4 S cm−1 Conductivity for Lithium‐Metal Batteries,https://advanced.onlinelibrary.wiley.com/doi/10.1002/aenm.202504143?af=R,2025-10-06 04:25:11,Wiley: Advanced Energy Materials: Table of Contents,2025-10-06 04:25:11+00:00
Electrolyte‐Driven Suppression of Oxygen Dimerization and Oxygen Evolution in High‐Voltage Li‐Ion Batteries,https://advanced.onlinelibrary.wiley.com/doi/10.1002/aenm.202503180?af=R,2025-10-06 04:26:11,Wiley: Advanced Energy Materials: Table of Contents,2025-10-06 04:26:11+00:00
Tuning Microscopic Water Orientation in Nickel Single‐Atom Catalyst for Commercial‐Scale CO2 Electrolysis to CO,https://onlinelibrary.wiley.com/doi/10.1002/anie.202516799?af=R,2025-10-06 04:31:00,Wiley: Angewandte Chemie International Edition: Table of Contents,2025-10-06 04:31:00+00:00
Quantification and Optimization of Interfacial Ion Transport in Polymer/Ceramic Composite Electrolytes for Solid‐State Batteries,https://onlinelibrary.wiley.com/doi/10.1002/anie.202517153?af=R,2025-10-06 04:32:15,Wiley: Angewandte Chemie International Edition: Table of Contents,2025-10-06 04:32:15+00:00
Degradation of G‐Quadruplex‐Binding Proteins by G4L‐PROTAC via Quaternary Complex Formation,https://onlinelibrary.wiley.com/doi/10.1002/anie.202515045?af=R,2025-10-06 04:38:43,Wiley: Angewandte Chemie International Edition: Table of Contents,2025-10-06 04:38:43+00:00
Nickel‐Catalyzed O‐Alkylisourea‐Enabled Electrochemical Radical C(sp3)−C(sp2) Cross‐Coupling,https://onlinelibrary.wiley.com/doi/10.1002/anie.202516173?af=R,2025-10-06 04:39:17,Wiley: Angewandte Chemie International Edition: Table of Contents,2025-10-06 04:39:17+00:00
"30 species of sharks, other marine organisms under threat from deep sea mining - India Today",https://news.google.com/rss/articles/CBMi8gFBVV95cUxQamdIUjRMTmJzeng4NTRUbTY2ajFwazNzYjZxcFFXeENqSGZMc2Z6Unc3ek80SWJXVnRmYS1EdzVVOElTOUZjVkdLdGdjSjY4MjJGakRMS2pDcHJYaFlCNmphLW9vcnhFelFzajVNcVQ4amZreU5hcHF6dXZIb21YQmJvWkYxaE9Gbk1BVExHWndmMGVQNXNPYW9Ja2Y5dkloOExpdFgxemhpZFpYblp1b0NMemNwNzZ4b3F0S01wMVJramFMT3VBZVpuTjh2MnMxY2FHSDlkcGpiWG5mWHhfWGtrQjJCUTRBeDZ0b0xoajlMd9IB9wFBVV95cUxONTJLRHdRYndzcl9qRy1zVkhqME5tZzRuNWM2c3dOc2xCck1LdFFRWnVKSnlWeS1NMXhqVURTbTlyRi1vWlFzYmxlTWFBX19rMFE1SnVFZG5fNnZmNndLNG9BYzA4UmFBcHN5U0RYUmhETVVBMW5RQlg3RXlvZGdMNVY3YVB1YXN1dUhoR1pVQUpjY1lrWlpyYUJnTS1JVDNXWFVOT1YtNW1uMXBrODU2dkpiOVdSS01CV0o4ZC1JUE9NazdScGFiUk1CMk1PcW5uU2hpeFF1VmtKVnYzUENyM2VyQlZscUpaYU5qR2lpcXJQOUdtTk1B?oc=5,2025-10-06 05:04:18,"""deep sea mining"" - Google News",2025-10-06 05:04:18+00:00
Big U.S. West Coast earthquakes could come as a one-two punch,https://www.science.org/content/article/big-u-s-west-coast-earthquakes-could-come-one-two-punch,2025-10-06 05:30:00,Latest News from Science Magazine,2025-10-06 05:30:00+00:00
Medicine Nobel goes to three researchers who identified immune system’s security guards,https://www.science.org/content/article/medicine-nobel-researchers-who-studied-how-body-polices-immune-system,2025-10-06 05:45:00,Latest News from Science Magazine,2025-10-06 05:45:00+00:00
"Asian push for carbon capture, storage could add 25 billion tonnes of emissions by 2050: Report - BusinessLine",https://news.google.com/rss/articles/CBMi7wFBVV95cUxNeVRGaFVoaHJ4RU1pd1FlbzBVQllyM29KaWd2Z3JSUTRqS2ZhYkhPMmFUcmZ0MmV5SVJTcFg0aXlZdWpSa0NsZ3htZC1HbFJoY2JGM0JCY0N5V1RIRVlieHc0YjhNOHJNMFdrdm9TS3NMRFA5VkZpUlJ2RFRvVHNfU1hwTU1kRGJxSnlaWU5KYW9ueHRCSERSOWFXd2hyMFJVajMwWnRaZW1JMFJ5QWk2Q2Y0SXpnTkFkY3otZ0pHaXZQdXEzaUtBN3JmR0daMk1ZNXphcFNicm9fRXhkOWVFYW5rcHZUbjdHZV9fanVrZ9IB9gFBVV95cUxPemxVZW5CWWtiOW1IWGh3c3FZYUt3ZUlpTjRDTXUtZVNYdmVFQ3Aya29NaXp5TWd5ZVppYkJPb1VlRXRaSmJTOVltSWZqS2ZHcXpGb19xOGQxVTRrUExEMGdSenVCVmVXQnBxM0NJNV9Tbm43cWxwM3lDUE5OVlVHc0ZmSGNnTVBQa1lUOUhrUmFfZFY3eWhRZTBBek9OTlB6MHFhbl8xVGR0NmpIMVFoRmdCS3oxXzRxQ0RYVHlfV2pUTk9WYU5UTG1wLU1KMGNmLVNXUXl3ZlM1ZS1KWXlMUGExTExRUG5tb0pNZkF3MjFSY2xqRGc?oc=5,2025-10-06 05:52:41,"""carbon capture OR CO2 storage"" - Google News",2025-10-06 05:52:41+00:00
New soft plastics recycling scheme to replace Australia failed REDcycle - Packaging Gateway,https://news.google.com/rss/articles/CBMisAFBVV95cUxQbmV1OENhd0hzblBtekZWcVNHUERvM2RIX3JpX1NSaG5rRGNqNDdfM1JBOWJLMnZLWG5WajdSMDVlOVp2TnVWZW90R3F0cWs5NGJVSFVlZUJkUHg0b3ppRTEyTEJsdjVQdjRmemhrdlRUZTJ1bnFqc21hdkkxZmJBZjRkeHB1elhHb3BrZDM0MVRMaEEtYlRnT3RRU3hMTUk3MDN0d0pPWUJaR2VRWTVUMQ?oc=5,2025-10-06 06:45:44,"""plastic recycling"" - Google News",2025-10-06 06:45:44+00:00
Unveiling Fast Charge Transfer Dynamics at Semiconductor/Electrocatalyst/Electrolyte Dual Interfaces via Boron Engineering for Efficient Water Splitting,https://advanced.onlinelibrary.wiley.com/doi/10.1002/aenm.202504275?af=R,2025-10-06 06:54:21,Wiley: Advanced Energy Materials: Table of Contents,2025-10-06 06:54:21+00:00
Multifunctional Dual‐Doping Strategy Improving Halide‐Based Solid‐State Electrolyte,https://advanced.onlinelibrary.wiley.com/doi/10.1002/aenm.202503135?af=R,2025-10-06 06:55:48,Wiley: Advanced Energy Materials: Table of Contents,2025-10-06 06:55:48+00:00
Permselective Covalent Organic Framework Membrane as Self‐Extinguishing Separator for High‐Safety Lithium‐Ion Battery,https://onlinelibrary.wiley.com/doi/10.1002/anie.202512591?af=R,2025-10-06 06:56:38,Wiley: Angewandte Chemie International Edition: Table of Contents,2025-10-06 06:56:38+00:00
Dual Vapor‐Phase Treatment Driven Subsurface Reorganization for 3D Passivation Networks toward Ultralow Interfacial Energy Loss in Perovskite Photovoltaics,https://advanced.onlinelibrary.wiley.com/doi/10.1002/aenm.202504299?af=R,2025-10-06 06:56:55,Wiley: Advanced Energy Materials: Table of Contents,2025-10-06 06:56:55+00:00
"A Triple Threat Against Ovarian Cancer: Os(II)‐Pt(IV)‐Ceritinib Conjugates for Photodynamic Therapy, Chemotherapy, and Immunogenic Cell Death Induction",https://onlinelibrary.wiley.com/doi/10.1002/anie.202518623?af=R,2025-10-06 06:57:22,Wiley: Angewandte Chemie International Edition: Table of Contents,2025-10-06 06:57:22+00:00
AlCl4−‐Deficient Eutectic Electrolytes Enable Reversible Iodine Redox‐Amphoteric Conversion for Aluminum Battery Cathodes,https://onlinelibrary.wiley.com/doi/10.1002/anie.202516059?af=R,2025-10-06 06:58:43,Wiley: Angewandte Chemie International Edition: Table of Contents,2025-10-06 06:58:43+00:00
Naphthalimide‐Based Type‐I Nano‐Photosensitizers for Enhanced Antitumor Photodynamic Therapy: H2S Synergistically Regulates PeT and Self‐Assembly,https://onlinelibrary.wiley.com/doi/10.1002/anie.202512150?af=R,2025-10-06 07:00:00,Wiley: Angewandte Chemie International Edition: Table of Contents,2025-10-06 07:00:00+00:00
Isolation of Anionic N‐Heterocyclic Olefins and Their Versatile Reactivity,https://onlinelibrary.wiley.com/doi/10.1002/anie.202516374?af=R,2025-10-06 07:03:37,Wiley: Angewandte Chemie International Edition: Table of Contents,2025-10-06 07:03:37+00:00
Crafting Immune‐Cancer Cell Crosstalk via Modular Multilayer Logic DNA Nanoadaptors,https://onlinelibrary.wiley.com/doi/10.1002/anie.202513673?af=R,2025-10-06 07:07:00,Wiley: Angewandte Chemie International Edition: Table of Contents,2025-10-06 07:07:00+00:00
Formation of Monolithic Magnesium–Calcium Carbonates Through Aggregation of Carbonate‐Cluster Nanodroplets,https://onlinelibrary.wiley.com/doi/10.1002/anie.202518706?af=R,2025-10-06 07:12:52,Wiley: Angewandte Chemie International Edition: Table of Contents,2025-10-06 07:12:52+00:00
"Asian push for carbon capture, storage could add 25 billion tonnes of emissions by 2050: report - The Hindu",https://news.google.com/rss/articles/CBMi_wFBVV95cUxNaUp0M3hfWF9WN05ta2RKeWtGaXBQOGxVSmdNelF6UmUtN3lkSzctNDQ3Q0w2NU42RHlVWi1ESGtPc2ZKM2tmV0RzUXJZcTQyMHV1MmxMRnRVZDh4dkJIOFBwTVM0OW1IVXJzQ0dVVXpMcENfY1lZZ25kNEkwRkMxaWtlLUYydWQ3eEhWSjhGbzRHeWZsNlBULU9CLWp0R1pDTGdJQXNza1dWSjN6MHdjSUZnYlJWb1ZVUGhaRXo3ZHZ3QVllRzNfMlZ2cjAxUkhIaFczZXhVUEw2RlYwd1JlNzNlU2V5Wnh1b2VjMHdYMV9oRWFsb1k3WTE3bU5ZeEnSAYYCQVVfeXFMT01MQVVHNFRZblk4ejBHZHBEM1NsZlI3U2VjSmZzbXZDQ3dXcFl4UldRREVDWVFaZDMwbl9uUmUxWElSMmF6RGlJNHB3Q1poRm82Tk5sSXlBenpzdDVKQWE1OXNtaXpMSVdUYnI4UXFYYUlxeWtZQWV6Q00zT1NPcUJJcmxRQXpYcVhKNVdBaGdUbEoxM01aZC1RQWJWRldxYngteGt6dDlSZ0NHQTdwN1VTNjl2NkRZQWtZS3FvcFg5dkNrRlNTMlFISHBmaFhYLUU4QUpwTnBEeS1WaXJVdy1aby1FdUFpbEZWUE1uM3Bta2pZQkdsNm1CaWpJYXlpTEw5T21tQQ?oc=5,2025-10-06 07:26:00,"""carbon capture OR CO2 storage"" - Google News",2025-10-06 07:26:00+00:00
PTTEP Poised to Benefit as Thailand Backs Carbon Capture Projects for Net Zero Goal - kaohoon international,https://news.google.com/rss/articles/CBMiYEFVX3lxTE1qR3ZWZC13VVpvNTczVWVER3J5Wm81czZqZUxuWERvc1hWcndjaVhpNjh6Zmt2aGxEUDhhdnA3OGx3eDlNQldpNmFiZXBEN3drMUJobnE4dUp3Z0JDd3RlLQ?oc=5,2025-10-06 07:29:21,"""carbon capture OR CO2 storage"" - Google News",2025-10-06 07:29:21+00:00
Japanese Airlines Mark First Public Carbon Credit Use Under CORSIA,https://carbonherald.com/japanese-airlines-mark-first-public-carbon-credit-use-under-corsia/?utm_source=rss&utm_medium=rss&utm_campaign=japanese-airlines-mark-first-public-carbon-credit-use-under-corsia,2025-10-06 07:45:45,Carbon Herald,2025-10-06 07:45:45+00:00
Hawai’i’s Sharks and Rays Further Threatened by Deep-Sea Mining - Technology Networks,https://news.google.com/rss/articles/CBMiwwFBVV95cUxOR1VzZC1ycnRheUhGWnM1NDNBWEZiOUpJUGRxX1ZqWXEzaC1FRHlCYnY4WlQwNVpOT3ZpblptejNSb3FZdHJPeVJoUlBvcXFGbFRxR016TnRFT29Hb2ZVaXFkQ2NSdmZMZFBTX0hyTXcxQjFuNTdXMjJ2dHBVdTltcEszVDZmUjVpNkxxWmRpaHozVVMtWDJNM3BuN1BoV1k1dEI4WWdNYUV3UERmZXQzYlZ4b1R3TFdvYzMzT293QnpUaWM?oc=5,2025-10-06 08:27:50,"""deep sea mining"" - Google News",2025-10-06 08:27:50+00:00
Thailand’s Power Sector to Gain Momentum from Government-Backed Carbon Capture Initiatives - SolarQuarter,https://news.google.com/rss/articles/CBMixAFBVV95cUxNRWpaZWZ3d2NDWVEtT3VaTlhlZU11N0dzRFZJSDRJRDlfOEp4QmFWUElsUXBWZm40elFqQkJxVk4yM0l6eVI1RkdTVDNMZTEzTkkyX0tUY3FadzY5WG16NjU4NkZyU3FMRm9LdFQwRTVkbkVuakp5TTZ0SGFEaXZaOHFFTGRUVzBScFFrVVc2SU5QZFNuVHg5R3JibWFXNTBGZkNJY3JQUmV2OEZDV0ZOV1dmaktPUkJRSXI5TGxzX0pudVBE?oc=5,2025-10-06 08:38:30,"""carbon capture OR CO2 storage"" - Google News",2025-10-06 08:38:30+00:00
Interfacial Synergistic Hydrogen Spillover and Electron Transfer for Boosting Electrocatalytic Nitrate Reduction to Ammonia,https://onlinelibrary.wiley.com/doi/10.1002/adma.202514834?af=R,2025-10-06 08:55:39,Wiley: Advanced Materials: Table of Contents,2025-10-06 08:55:39+00:00
Tuning Solvation Structure Via Inductive and Steric Hindrance Effects for High‐Voltage LiCoO2 Batteries,https://onlinelibrary.wiley.com/doi/10.1002/anie.202514299?af=R,2025-10-06 08:59:33,Wiley: Angewandte Chemie International Edition: Table of Contents,2025-10-06 08:59:33+00:00
Apple and Samsung users could be due share of £480m payout,https://www.bbc.com/news/articles/cn0rn7rwk24o?at_medium=RSS&at_campaign=rss,2025-10-06 09:04:05,BBC News,2025-10-06 09:04:05+00:00
Multifunctional Dithiol Crosslinking Additive Enables Highly Efficient and Stable Inkjet‐Printed Perovskite Quantum Dot Light‐Emitting Diodes,https://onlinelibrary.wiley.com/doi/10.1002/adma.202515555?af=R,2025-10-06 09:04:51,Wiley: Advanced Materials: Table of Contents,2025-10-06 09:04:51+00:00
Synergy of Block and Microporous Polymers with Tailored Zeolitic Imidazole Frameworks for Membrane‐Based Direct Air Capture,https://onlinelibrary.wiley.com/doi/10.1002/adma.202510740?af=R,2025-10-06 09:06:03,Wiley: Advanced Materials: Table of Contents,2025-10-06 09:06:03+00:00
Self‐Assembled Protonated Porphyrin Dimer Nanoparticles with an 83.7% Near‐Infrared Photothermal Conversion Efficiency for Antitumor Therapy,https://onlinelibrary.wiley.com/doi/10.1002/adma.202511160?af=R,2025-10-06 09:07:20,Wiley: Advanced Materials: Table of Contents,2025-10-06 09:07:20+00:00
Leveraging Cross‐Cutting Technologies to Unravel Light‐Heat‐Water Interactions at Solar Evaporation Interfaces: Propelling the Low‐Carbon Water‐Energy Nexus,https://onlinelibrary.wiley.com/doi/10.1002/adma.202516043?af=R,2025-10-06 09:08:51,Wiley: Advanced Materials: Table of Contents,2025-10-06 09:08:51+00:00
Personal Moisture Management by Advanced Textiles and Intelligent Wearables,https://onlinelibrary.wiley.com/doi/10.1002/adma.202508831?af=R,2025-10-06 09:08:54,Wiley: Advanced Materials: Table of Contents,2025-10-06 09:08:54+00:00
Enhancing Field Effects of Single‐Atom Ru/Lignin Carbon Nanoreactors for Electrocatalytic Hydrogen Evolution by Continuous Heterogeneous Curvature,https://onlinelibrary.wiley.com/doi/10.1002/adma.202515230?af=R,2025-10-06 09:10:05,Wiley: Advanced Materials: Table of Contents,2025-10-06 09:10:05+00:00
Synergistic Microstructure and Composition Engineering via Na2S Enables High‐Performance Porous PbTe Thermoelectrics with Ultrahigh Device Power Density,https://onlinelibrary.wiley.com/doi/10.1002/adma.202512589?af=R,2025-10-06 09:12:12,Wiley: Advanced Materials: Table of Contents,2025-10-06 09:12:12+00:00
Dual‐Zone Chloride Engineering to Enable Ultra‐Stable Two‐Electron Zinc‐Iodine Batteries,https://onlinelibrary.wiley.com/doi/10.1002/adma.202514117?af=R,2025-10-06 09:15:02,Wiley: Advanced Materials: Table of Contents,2025-10-06 09:15:02+00:00
Asia’s carbon capture gamble risks derailing global climate goals: Report - Down To Earth,https://news.google.com/rss/articles/CBMiuAFBVV95cUxQck9xcG95QlRZckh1cXFWRDFqd1NXbWc4MFF2X2lSU1RnVjZmQTl1TlNGTG1fNTVwNlJ4bmhMRWhKZG1HQWNDZlljQTJOTG9LQlN5Rm5sQjJhSjFVOUJodHNlZnlLRmdwNVU4bXZYandEUzYxRS1Cc0dqNFFBOENOQlBXU3cwbVBnQlZrS055dDE2Q3pZdnVjNzR4emdUU3NqQVZVendlTUtubGVPbllYUnVDOWVTX0Z00gHGAUFVX3lxTE1OOW9oMFRibUNqQVl5ckptRnZ6c2hPS2pzVkNhSExVV2VSY2ItRk1yOVZpUy1RT25zTThJUklWUzBqOGY3Q3V3LWFkcnQ3NlA3a2V3UVpYUDluRm1ldGNJT21rZ1FMc3pBV2VKUzB3VW1yai11bjJQMWJaUnNpTmJkUF9vM096c1JLN2FzRWRUa2V3Q1pya3Z5OC1pMmZQVjZ3bC1wR2ZBTmJveW51RV9scUhNZ1RQZlVRcDl0RXJwSW4zWnJSQQ?oc=5,2025-10-06 09:18:20,"""carbon capture OR CO2 storage"" - Google News",2025-10-06 09:18:20+00:00
Bioinspired Swelling‐Deswelling Strategy Unlocks Synergistic Molecular Solar Thermal‐Fabric Systems for Personal Thermal Management,https://onlinelibrary.wiley.com/doi/10.1002/adma.202514043?af=R,2025-10-06 09:19:10,Wiley: Advanced Materials: Table of Contents,2025-10-06 09:19:10+00:00
[ASAP] Excitation-Matchable Shortwave Infrared Quinolinium Fluorophores: Decoding Spatiotemporal Interactions with Multiplexed Bioimaging,http://dx.doi.org/10.1021/jacs.5c10749,2025-10-06 09:31:06,Journal of the American Chemical Society: Latest Articles (ACS Publications),2025-10-06 09:31:06+00:00
VPI’s Immingham Plant Becomes First in UK to Secure Full Carbon Capture Clearance,https://carbonherald.com/vpis-immingham-plant-becomes-first-in-uk-to-secure-full-carbon-capture-clearance/?utm_source=rss&utm_medium=rss&utm_campaign=vpis-immingham-plant-becomes-first-in-uk-to-secure-full-carbon-capture-clearance,2025-10-06 09:43:29,Carbon Herald,2025-10-06 09:43:29+00:00
"Construction begins at Protos carbon capture plant, following government backing - letsrecycle.com",https://news.google.com/rss/articles/CBMiswFBVV95cUxQUmdNVVczN0QxYmt0alNydDd5eWNMMHpyNlF1ZGwyQjNHZC1fZTNFRWRwYTllelhCT1hRSUwxTVNVeXBMTFpZYXRTYk1wS2pMVVR4UE9zTGNCWHNPSjhmU21odHJpTFZqUE5KQzlvVlhrY3V3THRESVI5d0JjUElkbk1iQV9mRXZMdzJ4RFRvQmVrNGpWMk9QM1l2bGw1NnVOTmEyRTNtQ3lXQlFMNEdUVXBKVQ?oc=5,2025-10-06 09:58:04,"""carbon capture OR CO2 storage"" - Google News",2025-10-06 09:58:04+00:00
"Uncharted waters: deep sea mining’s financial, environmental and regulatory challenges - IFLR",https://news.google.com/rss/articles/CBMizwFBVV95cUxNREtPTjZISzVRcnh2V001WmZYdjY3bE4yRkhia295UVFlSlp5VkNOa3d2aVlFT0V1eUdIbTBSc0VKOElqcTJxWDAxVndJbDFKdkd6cVYydFhuVURvYWxyeFRtc1lsbkJjZ0lEV05BUmp3YnhjelJOb0NGRkVWMUVHUzUydkZWZy1YcjVmRDdIMkoxVExkWThVazEyUmxGZE5COU9TbWRVX3JONVNzd1NvQWp5Ymxwcll1TUNaSVZKNXNja1F1dDFnSkVRMTZnRjA?oc=5,2025-10-06 10:00:53,"""deep sea mining"" - Google News",2025-10-06 10:00:53+00:00
Deep-sea mining threatens shark species that already face extinction - Earth.com,https://news.google.com/rss/articles/CBMinAFBVV95cUxOQWpsMHBLWlNuQ196RW9KaUVKOE5Rb3RoNnlQX0FUdldHS09peDFHLUVOa0RmUHJLSjFXRi1zSXR6U1ZIMEdHdXV5a01ycjVtZ2dGdGJ1UkYxbHpvRVd2ai05LVFtd0RkRHl4aW5OaE94MGd2Vm1ES2NjS2c1NDNFWUE0RFpRT1FBak9ER3ltd1BWWjFPMzlrQmhZRUI?oc=5,2025-10-06 10:51:35,"""deep sea mining"" - Google News",2025-10-06 10:51:35+00:00
"Nations’ Overreliance On Carbon Removal Could Undermine Climate Goals, Oxford Study Finds",https://carbonherald.com/nations-overreliance-on-carbon-removal-could-undermine-climate-goals-oxford-study-finds/?utm_source=rss&utm_medium=rss&utm_campaign=nations-overreliance-on-carbon-removal-could-undermine-climate-goals-oxford-study-finds,2025-10-06 10:51:38,Carbon Herald,2025-10-06 10:51:38+00:00
Germany's BASF to showcase polyamide recycling tech at K 2025 - ALCHEMPro,https://news.google.com/rss/articles/CBMiygFBVV95cUxQeVBCOWQwSTR6M2dWREhrMzFUUFRGa2RMWF9WUWoyMmxzQ3VnTE9uWGpJWmxiN3MwQzVMWTF1VGkyaVlNWF83SVliQWg2eElQZ0JsdTJsWmVkVU9PWGhvcGlHYmJzT0MxNUphUUlfbXFxY3Rxa1hyN0NYX3lqZ3hSUW1xeUpuR3hQQm9icUM3YUlhMk9VbVRNQXpDZG11T3h4MVhQc0JwbEtvQlZKaXhrZHkxd19SRFo5QllwczZNbTM4MW9FdEMtcHR3?oc=5,2025-10-06 11:03:22,"""plastic recycling"" - Google News",2025-10-06 11:03:22+00:00
Mechanochemical Cis/Trans Isomerization of a Metal Centre Involving a Metal‐Organic Halogen‐Bonded (MOXB) Cocrystal,https://onlinelibrary.wiley.com/doi/10.1002/anie.202517004?af=R,2025-10-06 11:14:28,Wiley: Angewandte Chemie International Edition: Table of Contents,2025-10-06 11:14:28+00:00
Developing Oxygen Vacancy Rich Perovskite for Broad‐Spectrum‐Responsive Photothermal Assisted Photocatalytic Dehydrogenation of MgH2,https://advanced.onlinelibrary.wiley.com/doi/10.1002/aenm.202504765?af=R,2025-10-06 11:15:57,Wiley: Advanced Energy Materials: Table of Contents,2025-10-06 11:15:57+00:00
BP India Exploring CCUS Pilots with Hard-to-Abate Industries: Kartikeya Dube - outlookbusiness.com,https://news.google.com/rss/articles/CBMitAFBVV95cUxNR3dkWEVkdHhHT0pNMWIzbkxGMHhfeWw4ejR0Umo0ZGdRSVhDc29raGk4WnpCd3laam1KaFliZkZBNURWdWFSUFpqODdIWmJIQk9MZFpaR0RiWFVEYVVoQkN2dVpBcEEwZmJuZWFodlB5ak9oZHgtbE1FblNoeEVheG44d2R1TklJWTBjVkxSaHA4RFdNcDFwM1ozYnRiUDZnOTJNRFF4M05wb2l0allDNmFNUEbSAcIBQVVfeXFMT0dpSTlUbTZTR2U2Z0M0ZHpHdHBJMnRJUE5iMVRRYjViRjgweUtLZjlNX0YtRnlEMVdCTk9zSlNaWkFVZUFBUm1lSU55Z2otaldGaVBXanFqOTRWYjM4VG5DS0hmd2lvc1BYRmdSdzBfeTZkaUFORHhQeE1vZWZjTkxEYzNNTEI3M2EySXZwZXRCaExERk15X0dHMVBONExCM0E1cmdkSlgwVXlOX1M2QllBTUF1cFBMcHlFcG5UdW9KQlE?oc=5,2025-10-06 11:40:05,"""CCUS"" - Google News",2025-10-06 11:40:05+00:00
[ASAP] Controlled Synthesis of Lipoate Homopolymers via Reversible Addition–Fragmentation Chain Transfer Polymerization,http://dx.doi.org/10.1021/jacs.5c14377,2025-10-06 11:43:54,Journal of the American Chemical Society: Latest Articles (ACS Publications),2025-10-06 11:43:54+00:00
