title,link,published,source,pub_date
Diverging fish biodiversity trends in cold and warm rivers and streams,https://www.nature.com/articles/s41586-025-09556-0,2025-09-24 00:00:00,Nature,2025-09-24 00:00:00+00:00
Periplasmic protein quality control at atomic level in live cells,https://www.nature.com/articles/s41467-025-62340-6,2025-09-24 00:00:00,Nature Communications,2025-09-24 00:00:00+00:00
Author Correction: Cytokinin depends on GA biosynthesis and signaling to regulate different aspects of vegetative phase change in Arabidopsis,https://www.nature.com/articles/s41467-025-64338-6,2025-09-24 00:00:00,Nature Communications,2025-09-24 00:00:00+00:00
Author Correction: Guanidine aptamers are present in vertebrate RNAs associated with calcium signaling and neuromuscular function,https://www.nature.com/articles/s41467-025-64474-z,2025-09-24 00:00:00,Nature Communications,2025-09-24 00:00:00+00:00
A haplotype-based evolutionary history of barley domestication,https://www.nature.com/articles/s41586-025-09533-7,2025-09-24 00:00:00,Nature,2025-09-24 00:00:00+00:00
The formation and propagation of human Robertsonian chromosomes,https://www.nature.com/articles/s41586-025-09540-8,2025-09-24 00:00:00,Nature,2025-09-24 00:00:00+00:00
Polaron superlattices in n-doped single conjugated polymers,https://www.nature.com/articles/s41565-025-02019-7,2025-09-24 00:00:00,Nature Nanotechnology,2025-09-24 00:00:00+00:00
Full-length protein classification via cysteine fingerprinting in solid-state nanopores,https://www.nature.com/articles/s41565-025-02016-w,2025-09-24 00:00:00,Nature Nanotechnology,2025-09-24 00:00:00+00:00
Meso–macroporous hydrogel for direct litre-scale isolation of extracellular vesicles,https://www.nature.com/articles/s41565-025-02011-1,2025-09-24 00:00:00,Nature Nanotechnology,2025-09-24 00:00:00+00:00
Breaking symmetry in time to protect light,https://www.nature.com/articles/s41565-025-02012-0,2025-09-24 00:00:00,Nature Nanotechnology,2025-09-24 00:00:00+00:00
Protecting double Holliday junctions ensures crossing over during meiosis,https://www.nature.com/articles/s41586-025-09555-1,2025-09-24 00:00:00,Nature,2025-09-24 00:00:00+00:00
In vivo CRISPR screens identify modifiers of CAR T cell function in myeloma,https://www.nature.com/articles/s41586-025-09489-8,2025-09-24 00:00:00,Nature,2025-09-24 00:00:00+00:00
Electrostatic-repulsion-based transfer of van der Waals materials,https://www.nature.com/articles/s41586-025-09510-0,2025-09-24 00:00:00,Nature,2025-09-24 00:00:00+00:00
The Biodiversity Cell Atlas: mapping the tree of life at cellular resolution,https://www.nature.com/articles/s41586-025-09312-4,2025-09-24 00:00:00,Nature,2025-09-24 00:00:00+00:00
Low-overhead transversal fault tolerance for universal quantum computation,https://www.nature.com/articles/s41586-025-09543-5,2025-09-24 00:00:00,Nature,2025-09-24 00:00:00+00:00
Engineered enzymes can suppress genome-editing errors,https://www.nature.com/articles/d41586-025-03071-y,2025-09-24 00:00:00,Nature,2025-09-24 00:00:00+00:00
Isothermal solidification for high-entropy alloy synthesis,https://www.nature.com/articles/s41586-025-09530-w,2025-09-24 00:00:00,Nature,2025-09-24 00:00:00+00:00
Trump’s $100K visa fee for foreign talent: how will it affect researchers?,https://www.nature.com/articles/d41586-025-03111-7,2025-09-24 00:00:00,Nature,2025-09-24 00:00:00+00:00
"Universities must move with the times: how six scholars tackle AI, mental health and more",https://www.nature.com/articles/d41586-025-03031-6,2025-09-24 00:00:00,Nature,2025-09-24 00:00:00+00:00
What research might be lost after the NIH’s cuts? <i>Nature</i> trained a bot to find out,https://www.nature.com/articles/d41586-025-02748-8,2025-09-24 00:00:00,Nature,2025-09-24 00:00:00+00:00
Robotic system takes chemistry into hyperspace,https://www.nature.com/articles/d41586-025-02821-2,2025-09-24 00:00:00,Nature,2025-09-24 00:00:00+00:00
Universities under fire must harness more of the financial value they create,https://www.nature.com/articles/d41586-025-03027-2,2025-09-24 00:00:00,Nature,2025-09-24 00:00:00+00:00
A foundation model for human-AI collaboration in medical literature mining,https://www.nature.com/articles/s41467-025-62058-5,2025-09-24 00:00:00,Nature Communications,2025-09-24 00:00:00+00:00
Climate change is reshaping fish communities in the United States,https://www.nature.com/articles/d41586-025-02826-x,2025-09-24 00:00:00,Nature,2025-09-24 00:00:00+00:00
Musical rhythm abilities and risk for developmental speech-language problems and disorders: epidemiological and polygenic associations,https://www.nature.com/articles/s41467-025-60867-2,2025-09-24 00:00:00,Nature Communications,2025-09-24 00:00:00+00:00
Activation entropy of dislocation glide in body-centered cubic metals from atomistic simulations,https://www.nature.com/articles/s41467-025-62390-w,2025-09-24 00:00:00,Nature Communications,2025-09-24 00:00:00+00:00
Proximal cooperative aerial manipulation with vertically stacked drones,https://www.nature.com/articles/s41586-025-09575-x,2025-09-24 00:00:00,Nature,2025-09-24 00:00:00+00:00
Robot-assisted mapping of chemical reaction hyperspaces and networks,https://www.nature.com/articles/s41586-025-09490-1,2025-09-24 00:00:00,Nature,2025-09-24 00:00:00+00:00
Collective homeostasis of condensation-prone proteins via their mRNAs,https://www.nature.com/articles/s41586-025-09568-w,2025-09-24 00:00:00,Nature,2025-09-24 00:00:00+00:00
Design of facilitated dissociation enables timing of cytokine signalling,https://www.nature.com/articles/s41586-025-09549-z,2025-09-24 00:00:00,Nature,2025-09-24 00:00:00+00:00
Arousal as a universal embedding for spatiotemporal brain dynamics,https://www.nature.com/articles/s41586-025-09544-4,2025-09-24 00:00:00,Nature,2025-09-24 00:00:00+00:00
Volcanic crisis reveals coupled magma system at Santorini and Kolumbo,https://www.nature.com/articles/s41586-025-09525-7,2025-09-24 00:00:00,Nature,2025-09-24 00:00:00+00:00
Systematic discovery of CRISPR-boosted CAR T cell immunotherapies,https://www.nature.com/articles/s41586-025-09507-9,2025-09-24 00:00:00,Nature,2025-09-24 00:00:00+00:00
Tailoring polymer electrolyte solvation for 600 Wh kg<sup>−1</sup> lithium batteries,https://www.nature.com/articles/s41586-025-09565-z,2025-09-24 00:00:00,Nature,2025-09-24 00:00:00+00:00
Ribonucleotide incorporation into mitochondrial DNA drives inflammation,https://www.nature.com/articles/s41586-025-09541-7,2025-09-24 00:00:00,Nature,2025-09-24 00:00:00+00:00
Convergent evolution of diverse jaw joints in mammaliamorphs,https://www.nature.com/articles/s41586-025-09572-0,2025-09-24 00:00:00,Nature,2025-09-24 00:00:00+00:00
SPP1 is required for maintaining mesenchymal cell fate in pancreatic cancer,https://www.nature.com/articles/s41586-025-09574-y,2025-09-24 00:00:00,Nature,2025-09-24 00:00:00+00:00
Industry-compatible silicon spin-qubit unit cells exceeding 99% fidelity,https://www.nature.com/articles/s41586-025-09531-9,2025-09-24 00:00:00,Nature,2025-09-24 00:00:00+00:00
The geoeconomic turn in decarbonization,https://www.nature.com/articles/s41586-025-09416-x,2025-09-24 00:00:00,Nature,2025-09-24 00:00:00+00:00
How a dangerous tick-borne virus sneaks into the brain,https://www.nature.com/articles/d41586-025-03124-2,2025-09-24 00:00:00,Nature,2025-09-24 00:00:00+00:00
A tweezer array with 6100 highly coherent atomic qubits,https://www.nature.com/articles/s41586-025-09641-4,2025-09-24 00:00:00,Nature,2025-09-24 00:00:00+00:00
Nitrogen-atom insertion enables skeletal editing of pyrrolidines for tetrahydropyridazine synthesis,https://www.cell.com/chem/fulltext/S2451-9294(25)00348-1?rss=yes,2025-09-24 00:00:00,Chem,2025-09-24 00:00:00+00:00
Unlocking the synthesis of homochiral carborane-fused boraphenanthrenes,https://www.cell.com/chem/fulltext/S2451-9294(25)00370-5?rss=yes,2025-09-24 00:00:00,Chem,2025-09-24 00:00:00+00:00
Reprogramming neuroblastoma by diet-enhanced polyamine depletion,https://www.nature.com/articles/s41586-025-09564-0,2025-09-24 00:00:00,Nature,2025-09-24 00:00:00+00:00
LRP8 is a receptor for tick-borne encephalitis virus,https://www.nature.com/articles/s41586-025-09500-2,2025-09-24 00:00:00,Nature,2025-09-24 00:00:00+00:00
Protecting animal cultures as World Heritage,https://www.nature.com/articles/s41893-025-01641-6,2025-09-24 00:00:00,Nature Sustainability,2025-09-24 00:00:00+00:00
Shared genetic architecture contributes to risk of major cardiovascular diseases,https://www.nature.com/articles/s41467-025-62419-0,2025-09-24 00:00:00,Nature Communications,2025-09-24 00:00:00+00:00
Role of the real first interface in regulating ionic signal of nanochannels,https://www.nature.com/articles/s41467-025-62077-2,2025-09-24 00:00:00,Nature Communications,2025-09-24 00:00:00+00:00
Boosting immune cells to combat cancer using CRISPR engineering and large-scale <i>in vivo</i> testing,https://www.nature.com/articles/d41586-025-02595-7,2025-09-24 00:00:00,Nature,2025-09-24 00:00:00+00:00
Holliday junction–ZMM protein feedback enables meiotic crossover assurance,https://www.nature.com/articles/s41586-025-09559-x,2025-09-24 00:00:00,Nature,2025-09-24 00:00:00+00:00
Arousal reframed as an organism‑wide dynamic system,https://www.nature.com/articles/d41586-025-03067-8,2025-09-24 00:00:00,Nature,2025-09-24 00:00:00+00:00
Quantification of enantiomorphs in chiral crystalline powders through three-dimensional electron diffraction,https://www.nature.com/articles/s41557-025-01950-5,2025-09-24 00:00:00,Nature Chemistry,2025-09-24 00:00:00+00:00
Homologous metal heteromaterials for ultrastable eletrocatalysis,https://academic.oup.com/nsr/advance-article/doi/10.1093/nsr/nwaf411/8262905?rss=1,2025-09-24 00:00:00,National Science Review Advance Access,2025-09-24 00:00:00+00:00
Discovery of a heavy silicon isotope mantle reservoir,https://academic.oup.com/nsr/advance-article/doi/10.1093/nsr/nwaf410/8262908?rss=1,2025-09-24 00:00:00,National Science Review Advance Access,2025-09-24 00:00:00+00:00
Inhalable materials and biologics for lung defence and drug delivery,https://www.nature.com/articles/s41578-025-00841-y,2025-09-24 00:00:00,Nature Reviews Materials,2025-09-24 00:00:00+00:00
Fundamentals of charge transport in two-dimensional framework materials,https://www.nature.com/articles/s41578-025-00840-z,2025-09-24 00:00:00,Nature Reviews Materials,2025-09-24 00:00:00+00:00
Tylenol is over 130 years old — why is it still the gold-standard painkiller?,https://www.nature.com/articles/d41586-025-03116-2,2025-09-24 00:00:00,Nature,2025-09-24 00:00:00+00:00
Jazzy jaw joints: evolutionary fine-tuning reveals unexpected bone connections in ancient predecessors of mammals,https://www.nature.com/articles/d41586-025-02823-0,2025-09-24 00:00:00,Nature,2025-09-24 00:00:00+00:00
Machine learning reveals potential consequences of cuts to US research,https://www.nature.com/articles/d41586-025-03066-9,2025-09-24 00:00:00,Nature,2025-09-24 00:00:00+00:00
A press release from just before the singularity,https://www.nature.com/articles/d41586-025-02952-6,2025-09-24 00:00:00,Nature,2025-09-24 00:00:00+00:00
How universities came to be — and why they are in trouble now,https://www.nature.com/articles/d41586-025-03030-7,2025-09-24 00:00:00,Nature,2025-09-24 00:00:00+00:00
The great university shake-up: four charts show how global higher education is changing,https://www.nature.com/articles/d41586-025-03028-1,2025-09-24 00:00:00,Nature,2025-09-24 00:00:00+00:00
Electrostatic-based transfer keeps 2D materials ultra-clean,https://www.nature.com/articles/d41586-025-02822-1,2025-09-24 00:00:00,Nature,2025-09-24 00:00:00+00:00
A common chromosome fusion in humans explained,https://www.nature.com/articles/d41586-025-03061-0,2025-09-24 00:00:00,Nature,2025-09-24 00:00:00+00:00
She lived to 117: what her genes and lifestyle tell us about longevity,https://www.nature.com/articles/d41586-025-03112-6,2025-09-24 00:00:00,Nature,2025-09-24 00:00:00+00:00
It’s not wokeness — it’s human rights,https://www.nature.com/articles/d41586-025-02932-w,2025-09-24 00:00:00,Nature,2025-09-24 00:00:00+00:00
The future of universities: a <i>Nature</i> special report,https://www.nature.com/articles/d41586-025-03086-5,2025-09-24 00:00:00,Nature,2025-09-24 00:00:00+00:00
Using short synthetic nucleic acids to probe genes in viruses that infect bacteria,https://www.nature.com/articles/d41586-025-03074-9,2025-09-24 00:00:00,Nature,2025-09-24 00:00:00+00:00
Exclusive: RFK Jr cancelled mRNA research — but the US military is still funding it,https://www.nature.com/articles/d41586-025-03093-6,2025-09-24 00:00:00,Nature,2025-09-24 00:00:00+00:00
Universities are — and must continue to be — a force for good,https://www.nature.com/articles/d41586-025-03065-w,2025-09-24 00:00:00,Nature,2025-09-24 00:00:00+00:00
"Fighting climate change takes more than data — it needs wonder, love and hope",https://www.nature.com/articles/d41586-025-03032-5,2025-09-24 00:00:00,Nature,2025-09-24 00:00:00+00:00
A drug–diet combination could improve childhood cancer treatment,https://www.nature.com/articles/d41586-025-02824-z,2025-09-24 00:00:00,Nature,2025-09-24 00:00:00+00:00
How a tick-borne virus enters human cells,https://www.nature.com/articles/d41586-025-02593-9,2025-09-24 00:00:00,Nature,2025-09-24 00:00:00+00:00
"No lectures, exams, essays: inside a twenty-first-century university",https://www.nature.com/articles/d41586-025-03034-3,2025-09-24 00:00:00,Nature,2025-09-24 00:00:00+00:00
From trash to treasure: Indonesian scientists turn plastic bags into glowing water sensors - EurekAlert!,https://news.google.com/rss/articles/CBMiXEFVX3lxTE16cXpRU1lQZUlhU3R2aGVkRnN1NHc1YXFkbV9mcllodWQzTUxRRkhYU3hoNmdXNUxFa0VlVW9GXzY0bWhwSTBRWVVsX2VYYWtEeVdkSmJDb3IwSDVJ?oc=5,2025-09-24 00:12:04,"""plastic recycling"" - Google News",2025-09-24 00:12:04+00:00
"New Orleans Lands Nearly $5.4M for a Citywide Recycling Upgrade, Here’s What It Means for Residents - Big Easy Magazine",https://news.google.com/rss/articles/CBMi0gFBVV95cUxOY1p6TzREWEgzM2xuSnIydE5pNWE1Tmd4R1BKTlYyczQya0pHQm0tb01KdHdQOUZWZTA2V2VWMTBzMkUwRlpoN0l1cnpMNmY4X0NwUi1WaUttdmkzS0QzaU4tTVZkZjhRWWtRWWdiS0dxRnVUVmw2TlRDMWJ3WHZCNm84U1drZGhSZFpZRDFvVjZMWjJhYUVrR2xqTGxoWk1IdE5Cd0FHbDd4S3hlZVNTM3VtcC1jcWtqYmg3Rk44RmtseEwxeC1aSEVMZVRuOFBZU0E?oc=5,2025-09-24 00:16:43,"""plastic recycling"" - Google News",2025-09-24 00:16:43+00:00
"TikTok child data protection inadequate, Canadian privacy officials say",https://www.bbc.com/news/articles/c4gj5lqq52lo?at_medium=RSS&at_campaign=rss,2025-09-24 01:46:55,BBC News,2025-09-24 01:46:55+00:00
SWLA residents voice concerns about CO2 projects at public meeting - KPLC 7 News,https://news.google.com/rss/articles/CBMijwFBVV95cUxQZjBJaEYzNTBPNG55dUdJeUlBbTlfcUpuSGgyU2htQVlfVGpvSjJNaExMeDdxdVR5MXlxd0tFVEM4UHlUNnhLcDc0eU9DMDZxWXdvVnZ4LVd1NFpHeWxvUXVKcnQ0d3F3MzlyXzBNYXY0U2NfRlY5X1pZRTRHY2JhTDUwNjRoZ1JwOE1rQWhzd9IBowFBVV95cUxPWTM2RGZGYnE0Zko3Qmh5MDROR0RhM0FNV2tLY0lMcExORDRaVVUwTXlQZUE4Z3hjTG9DeDNWVmhTTEJ3RFU2WldnYUpfQWpRbXVndk5TOUlwNTB2bXRkQzEwTW04QUp4QzNPQlBjVFRNNUF6elF0emxwR3Y3ZFplYzlEWVZ2eU9Za0phVl93b0loVW0zSHRGNkh5b0VOaHJrRHZR?oc=5,2025-09-24 02:22:00,"""carbon capture OR CO2 storage"" - Google News",2025-09-24 02:22:00+00:00
"Malaysia, Indonesia accelerate carbon capture and storage projects - Nikkei Asia",https://news.google.com/rss/articles/CBMiqAFBVV95cUxQM2tfWFJhdktjajRrMmZKWEh1NUVlMkRScks0UzJfc3cyLWkySGFuZHE3aTVPYkFGM2haa2ZEbnlMQ0U2ZXFvdlQ1SmxXUnNOWGVzR1drcXA3TExzNHZhbzQzOEVpbDROdDNQYjVwVG5WODNGeGp4X3VEV1ZvQjhMbGRFbTBVTm1fLTRxbDlFYjVBRTJtQVNobHZhbExyOTNKZ0g1ZDFVU2U?oc=5,2025-09-24 03:28:00,"""carbon capture OR CO2 storage"" - Google News",2025-09-24 03:28:00+00:00
Pellenc ST helps plastics recycler sort its material - Recycling Today,https://news.google.com/rss/articles/CBMiuwFBVV95cUxNVUpnRXFLd2d3d01sSDJ3UVpZZXAyUml4alZxd3JPaXJmb1E4bUZOYy1BeXVRZ0ZMbnBnVm1vbUJTeEp5ZkRDdDlaZXE3SUJjNUFtVWk5dlpRWW13Si1WRXRNOG5MbmYwLVp0TGNabDVhYVk0WUZwWWs4eXJUY2s1NDNzV09jS0RxLXc4UlZMTHNsLUJjMlZVV2V1S2lFb294ZUNWU29aemt1bWh6UnR4cUhMdmp1blRFVXlv?oc=5,2025-09-24 04:23:20,"""plastic recycling"" - Google News",2025-09-24 04:23:20+00:00
A ‘solar bump’ could help data centers recover wasted energy,https://www.science.org/content/article/solar-bump-could-help-data-centers-recover-wasted-energy,2025-09-24 05:05:06,Latest News from Science Magazine,2025-09-24 05:05:06+00:00
New Catalyst Could Make Plastic Recycling Whole Lot Less Complicated - خبرگزاری آنا,https://news.google.com/rss/articles/CBMinAFBVV95cUxPN29PejdNT1hhUXdFdm5vR0RyeHZabXVLOTNIb21PSnhxUnk1VlhJSXoyVEx5RkNyT2gtRXFMbU04SVJIU09TQXdvaG5ib2tMcm5zMW5sV0lEdmIxSDJRYUItR0M3YTRFSlp1ekhTX0dpdExTUTFvWGRVUGYzYkt4ZGlXazdBaXBuRzZtTnE3M2JxS0F1SjJGS2hEY1I?oc=5,2025-09-24 05:49:18,"""plastic recycling"" - Google News",2025-09-24 05:49:18+00:00
Responsible Use of Kinematic Models: Correspondence on “Navigating Ball Mill Specifications for Theory‐to‐Practice Reproducibility in Mechanochemistry”,https://onlinelibrary.wiley.com/doi/10.1002/anie.202512324?af=R,2025-09-24 05:54:29,Wiley: Angewandte Chemie International Edition: Table of Contents,2025-09-24 05:54:29+00:00
Dual‐Channel Gas‐Sensitive Fluorescent Switch: Realizing a Reversible Fluorescent Response to HCl and NH3,https://onlinelibrary.wiley.com/doi/10.1002/anie.202518302?af=R,2025-09-24 05:55:41,Wiley: Angewandte Chemie International Edition: Table of Contents,2025-09-24 05:55:41+00:00
Inside Back Cover: Conformation‐Adaptive Transformations of Flexible Frameworks: From Controlled Stimuli‐Responsiveness to Regulated Responsive Behaviors,https://onlinelibrary.wiley.com/doi/10.1002/anie.202520543?af=R,2025-09-24 05:58:39,Wiley: Angewandte Chemie International Edition: Table of Contents,2025-09-24 05:58:39+00:00
Outside Back Cover: Semiconductor Cluster with High Reduction Potential and Efficient Charge Transfer Enables Visible‐Light‐Driven Activation of Inert Organic Substrates,https://onlinelibrary.wiley.com/doi/10.1002/anie.202520544?af=R,2025-09-24 05:59:04,Wiley: Angewandte Chemie International Edition: Table of Contents,2025-09-24 05:59:04+00:00
"In a first, a gene therapy seems to slow Huntington disease",https://www.science.org/content/article/first-gene-therapy-seems-slow-huntington-disease,2025-09-24 06:00:00,Latest News from Science Magazine,2025-09-24 06:00:00+00:00
Inside Front Cover: Tunable Copolymerization of Oxetane and Anhydrides via a Nonsymmetric Three‐Center Four‐Electron Iodine Activation Mode,https://onlinelibrary.wiley.com/doi/10.1002/anie.202520538?af=R,2025-09-24 06:01:21,Wiley: Angewandte Chemie International Edition: Table of Contents,2025-09-24 06:01:21+00:00
New IDTechEx Report Forecasts 700 Million Tonnes of CO2 Captured Each Year by 2036 - AZoCleantech,https://news.google.com/rss/articles/CBMiYEFVX3lxTE5TWDFQU3NnNWkxel92VHY0S0pXQ3JxS1JOMDFrelNBM3hWTG5yVU1jM0hpdjlnZzdBLVItRjN3dE5XNlI4Tm56eDBvM1I1NWFrNERqRklBOHlEZG52eWNuNA?oc=5,2025-09-24 06:13:00,"""CCUS"" - Google News",2025-09-24 06:13:00+00:00
Reverse Modulation of Carbon‐Interface Electron Density via s‐d Block High‐Entropy‐Alloys Boosts Li–S Batteries,https://onlinelibrary.wiley.com/doi/10.1002/anie.202517660?af=R,2025-09-24 06:17:57,Wiley: Angewandte Chemie International Edition: Table of Contents,2025-09-24 06:17:57+00:00
Sequence‐Specific Installation of Aryl Groups in RNA via DNA‐Catalyst Conjugates,https://onlinelibrary.wiley.com/doi/10.1002/anie.202515681?af=R,2025-09-24 06:18:19,Wiley: Angewandte Chemie International Edition: Table of Contents,2025-09-24 06:18:19+00:00
Quantum Interference Effect in Saturated Systems: Effect of Anchoring Group Position on Conductance of Bipiperidines and their in‐situ Derived Dithiocarbamates,https://onlinelibrary.wiley.com/doi/10.1002/anie.202513806?af=R,2025-09-24 06:24:34,Wiley: Angewandte Chemie International Edition: Table of Contents,2025-09-24 06:24:34+00:00
Emerging Nitroso/Hydroxylamine Redox Chemistry for High‐Performance Organic Cathodes in Aqueous Proton Batteries,https://onlinelibrary.wiley.com/doi/10.1002/anie.202514164?af=R,2025-09-24 06:24:49,Wiley: Angewandte Chemie International Edition: Table of Contents,2025-09-24 06:24:49+00:00
Localizing the Long‐Range Disorder of Reconstructed Cobalt Oxyhydroxides for Anion Exchange Membrane Water Electrolysis,https://onlinelibrary.wiley.com/doi/10.1002/anie.202513592?af=R,2025-09-24 06:51:20,Wiley: Angewandte Chemie International Edition: Table of Contents,2025-09-24 06:51:20+00:00
CDOP Coalition Releases Open-Source Data Model To Standardize Carbon Markets,https://carbonherald.com/cdop-coalition-releases-open-source-data-model-to-standardize-carbon-markets/?utm_source=rss&utm_medium=rss&utm_campaign=cdop-coalition-releases-open-source-data-model-to-standardize-carbon-markets,2025-09-24 06:52:15,Carbon Herald,2025-09-24 06:52:15+00:00
Processing soft thin films on liquid surface for seamless creation of on-liquid walkable devices,https://www.science.org/doi/abs/10.1126/sciadv.ady9840?af=R,2025-09-24 07:00:00,AAAS: Science Advances: Table of Contents,2025-09-24 07:00:00+00:00
Site-specific adaptive nanovesicles for oral insulin delivery,https://www.science.org/doi/abs/10.1126/sciadv.ady6386?af=R,2025-09-24 07:00:00,AAAS: Science Advances: Table of Contents,2025-09-24 07:00:00+00:00
From disorder to icosahedral symmetry: How conformation-switching subunits enable RNA virus assembly,https://www.science.org/doi/abs/10.1126/sciadv.ady7241?af=R,2025-09-24 07:00:00,AAAS: Science Advances: Table of Contents,2025-09-24 07:00:00+00:00
Slab tearing and segmented subduction termination driven by transform tectonics,https://www.science.org/doi/abs/10.1126/sciadv.ady8347?af=R,2025-09-24 07:00:00,AAAS: Science Advances: Table of Contents,2025-09-24 07:00:00+00:00
Impaired macroautophagy in oligodendrocyte precursor cells suppresses neuronal plasticity via a senescence-associated signaling,https://www.science.org/doi/abs/10.1126/sciadv.adq7665?af=R,2025-09-24 07:00:00,AAAS: Science Advances: Table of Contents,2025-09-24 07:00:00+00:00
MSC-encapsulated porous microparticle eye drops for autoimmune dry eye disease treatment in NOD mice,https://www.science.org/doi/abs/10.1126/sciadv.adu9772?af=R,2025-09-24 07:00:00,AAAS: Science Advances: Table of Contents,2025-09-24 07:00:00+00:00
Elucidating the structure and assembly mechanism of actinoporin pores in complex membrane environments,https://www.science.org/doi/abs/10.1126/sciadv.adv0683?af=R,2025-09-24 07:00:00,AAAS: Science Advances: Table of Contents,2025-09-24 07:00:00+00:00
BDNF-driven synaptic plasticity requires autocrine matrix metalloproteinase–9 activity,https://www.science.org/doi/abs/10.1126/sciadv.adx2369?af=R,2025-09-24 07:00:00,AAAS: Science Advances: Table of Contents,2025-09-24 07:00:00+00:00
Acoustically powered micro-clampbot for single-particle transportation,https://www.science.org/doi/abs/10.1126/sciadv.ady3213?af=R,2025-09-24 07:00:00,AAAS: Science Advances: Table of Contents,2025-09-24 07:00:00+00:00
Endo-exo framework for a unifying classification of episodic landslide movements: Implications for forecasting catastrophic failures,https://www.science.org/doi/abs/10.1126/sciadv.ady9141?af=R,2025-09-24 07:00:00,AAAS: Science Advances: Table of Contents,2025-09-24 07:00:00+00:00
Laser-architected MXene composite for photoenhanced microsupercapacitor,https://www.science.org/doi/abs/10.1126/sciadv.ady0136?af=R,2025-09-24 07:00:00,AAAS: Science Advances: Table of Contents,2025-09-24 07:00:00+00:00
Steric repulsion counteracts ER–to–lipid droplet protein movement,https://www.science.org/doi/abs/10.1126/sciadv.adu6998?af=R,2025-09-24 07:00:00,AAAS: Science Advances: Table of Contents,2025-09-24 07:00:00+00:00
Quantum-enhanced multiparameter sensing in a single mode,https://www.science.org/doi/abs/10.1126/sciadv.adw9757?af=R,2025-09-24 07:00:00,AAAS: Science Advances: Table of Contents,2025-09-24 07:00:00+00:00
An interoceptive model of energy allostasis linking metabolic and mental health,https://www.science.org/doi/abs/10.1126/sciadv.ady4356?af=R,2025-09-24 07:00:00,AAAS: Science Advances: Table of Contents,2025-09-24 07:00:00+00:00
Quantum fluids of light in 2D artificial reconfigurable aperiodic crystals with tailored coupling,https://www.science.org/doi/abs/10.1126/sciadv.adz2484?af=R,2025-09-24 07:00:00,AAAS: Science Advances: Table of Contents,2025-09-24 07:00:00+00:00
Salient experiences enhance mundane memories through graded prioritization,https://www.science.org/doi/abs/10.1126/sciadv.ady1704?af=R,2025-09-24 07:00:00,AAAS: Science Advances: Table of Contents,2025-09-24 07:00:00+00:00
Technological complexity and combinatorial invention in small-scale societies,https://www.science.org/doi/abs/10.1126/sciadv.adv6153?af=R,2025-09-24 07:00:00,AAAS: Science Advances: Table of Contents,2025-09-24 07:00:00+00:00
Interfacial chain-growth polymerization enables polypropylene-like and circular polythioglycolide,https://www.science.org/doi/abs/10.1126/sciadv.adv5467?af=R,2025-09-24 07:00:00,AAAS: Science Advances: Table of Contents,2025-09-24 07:00:00+00:00
Structural basis of Pseudomonas biofilm-forming functional amyloid FapC formation,https://www.science.org/doi/abs/10.1126/sciadv.adx7829?af=R,2025-09-24 07:00:00,AAAS: Science Advances: Table of Contents,2025-09-24 07:00:00+00:00
The MC4-La1 cleavage module restricts plant virus infection by integrating R-motif–mediated defense mRNA translation,https://www.science.org/doi/abs/10.1126/sciadv.adv0819?af=R,2025-09-24 07:00:00,AAAS: Science Advances: Table of Contents,2025-09-24 07:00:00+00:00
Neuromorphic olfaction with ultralow-power gas sensors and ovonic threshold switch,https://www.science.org/doi/abs/10.1126/sciadv.adv9222?af=R,2025-09-24 07:00:00,AAAS: Science Advances: Table of Contents,2025-09-24 07:00:00+00:00
