title,link,published,source,pub_date
Exploring nationwide patterns of sleep problems from late adolescence to adulthood using machine learning,https://www.science.org/doi/abs/10.1126/sciadv.adw1227?af=R,2025-09-24 07:00:00,AAAS: Science Advances: Table of Contents,2025-09-24 07:00:00+00:00
Gut epithelium modifies enteric behaviors during nutritional adversity via distinct peptidergic signaling axes,https://www.science.org/doi/abs/10.1126/sciadv.adw1270?af=R,2025-09-24 07:00:00,AAAS: Science Advances: Table of Contents,2025-09-24 07:00:00+00:00
Glioblastoma exploits ATP from leading-edge astrocytes to fuel its infiltrative growth revealed by spatially resolved chimeric analysis,https://www.science.org/doi/abs/10.1126/sciadv.adv5673?af=R,2025-09-24 07:00:00,AAAS: Science Advances: Table of Contents,2025-09-24 07:00:00+00:00
Optical tweezers with light aligned along the particle’s trajectory enable playing tennis with light rackets,https://www.science.org/doi/abs/10.1126/sciadv.adx1485?af=R,2025-09-24 07:00:00,AAAS: Science Advances: Table of Contents,2025-09-24 07:00:00+00:00
Synchronization of women’s menstruation with the Moon has decreased but remains detectable when gravitational pull is strong,https://www.science.org/doi/abs/10.1126/sciadv.adw4096?af=R,2025-09-24 07:00:00,AAAS: Science Advances: Table of Contents,2025-09-24 07:00:00+00:00
How sighing regulates pulmonary surfactant structure and its role in breathing mechanics,https://www.science.org/doi/abs/10.1126/sciadv.adx6034?af=R,2025-09-24 07:00:00,AAAS: Science Advances: Table of Contents,2025-09-24 07:00:00+00:00
Liquid crystal–guided DNA information storage: Nondestructive recovery and long-term preservation,https://www.science.org/doi/abs/10.1126/sciadv.adu3957?af=R,2025-09-24 07:00:00,AAAS: Science Advances: Table of Contents,2025-09-24 07:00:00+00:00
Cryo-EM snapshots of NMDA receptor activation illuminate sequential rearrangements,https://www.science.org/doi/abs/10.1126/sciadv.adx4647?af=R,2025-09-24 07:00:00,AAAS: Science Advances: Table of Contents,2025-09-24 07:00:00+00:00
A microneedle device for rapid dermal interstitial fluid sampling,https://www.science.org/doi/abs/10.1126/sciadv.adx5492?af=R,2025-09-24 07:00:00,AAAS: Science Advances: Table of Contents,2025-09-24 07:00:00+00:00
Issue Editorial Masthead,https://pubs.acs.org/doi/10.1021/crv125i018_1987134?af=R,2025-09-24 07:01:11,acs: Chemical Reviews: Table of Contents,2025-09-24 07:01:11+00:00
Issue Publication Information,https://pubs.acs.org/doi/10.1021/crv125i018_1987133?af=R,2025-09-24 07:01:11,acs: Chemical Reviews: Table of Contents,2025-09-24 07:01:11+00:00
"AI tool helped recover £500m lost to fraud, government says",https://www.bbc.com/news/articles/cpd92gpld0go?at_medium=RSS&at_campaign=rss,2025-09-24 07:11:54,BBC News,2025-09-24 07:11:54+00:00
China Installs First Centrifugal Onboard Carbon Capture On Bulk Carrier,https://carbonherald.com/china-installs-first-centrifugal-onboard-carbon-capture-on-bulk-carrier/?utm_source=rss&utm_medium=rss&utm_campaign=china-installs-first-centrifugal-onboard-carbon-capture-on-bulk-carrier,2025-09-24 07:18:23,Carbon Herald,2025-09-24 07:18:23+00:00
Collaboration yields “world-first” EU food safe approved recycled PP - Packaging Europe,https://news.google.com/rss/articles/CBMiswFBVV95cUxOYXlNTVhPQy1TX1dVRldQVVI1LVZVS1BKaU1TbWR5am81ZWdoQi1JSmp5OUFsQTBXMmNwNGptTnUtQnItZFZBWUdjZjU0S0VhVUUtejN2STBYQjJ6eG9LcDdkeE9LSGE5YWlvd1JtNUIxZWJ2S0MwVUcxQUdkUDVLTkdkMEs4YURfM2dWbm9WNktRVmJnVTRMSWZiWEdPQk9tRW5hNDFEU3JjR2tvWFprdXhIWQ?oc=5,2025-09-24 08:04:43,"""plastic recycling"" - Google News",2025-09-24 08:04:43+00:00
YouTube content creators contributed £2.2bn to UK economy in 2024,https://www.bbc.com/news/articles/c0knpm6v36go?at_medium=RSS&at_campaign=rss,2025-09-24 09:03:45,BBC News,2025-09-24 09:03:45+00:00
WASP’s New 3D Printer is a Monster That Feeds on Recycled Plastic - All3DP,https://news.google.com/rss/articles/CBMiT0FVX3lxTE8td083MHlZRm1uRDBodDBpa0RkbHhJZ2pmQndkWkw3YWZudGF2NTBlWHo2NTBMTTE2eWZwV2VTRnczd2dJOElaWklhX2xEV2c?oc=5,2025-09-24 09:06:00,"""plastic recycling"" - Google News",2025-09-24 09:06:00+00:00
"Isometric, Anglo American, And ZeroEx Partner To Deliver Verified Carbon Credits",https://carbonherald.com/isometric-anglo-american-and-zeroex-partner-to-deliver-verified-carbon-credits/?utm_source=rss&utm_medium=rss&utm_campaign=isometric-anglo-american-and-zeroex-partner-to-deliver-verified-carbon-credits,2025-09-24 09:13:18,Carbon Herald,2025-09-24 09:13:18+00:00
Axium adds to plastics recycling capacity in Ontario - Recycling Today,https://news.google.com/rss/articles/CBMiqAFBVV95cUxOTVprbTJnODAwVXBHYXdrV0w3VG9TNVZWWjZZdEFWcEFhWFhERGVmalNGX0RvSkEzNUZYbExvRllUS2ZmTkpQWUpOY253YlhXUWt5TGtTeHFmNHUzUW42aXl1b2ZOYkYwWlN5eU1LeFNyekkzZDdLUnVSN1ptLVk5cG1Dc1ZkWE9mYzRwWVo3bjZSSVlCbFRiVVJJZklhNklGS0dRVmpHT28?oc=5,2025-09-24 09:27:15,"""plastic recycling"" - Google News",2025-09-24 09:27:15+00:00
Carbios revives Longlaville project as France rewards local plastic recycling - Sustainable Plastics,https://news.google.com/rss/articles/CBMitgFBVV95cUxPVThjeUxqS1VZUWhrdHpwa2JqZ2JBaGVBb3VUSnNOWVRqQzJ3ZHp4aXJyVFFrVFZXNlNQUDk5Mi12cEJMMmdvWno2R0tOWDNqNlhxRnNhSWEzNm93YmdHWmtBQ195TzhmMGR0TXAtOXFsRU1mOGxoN084cUE3VnY4M2syWXFWMXZENHV4cWJBOUxjT2NaRGppNVZvZ2JOd0NiRGFTdUpmcEl0OXVDTVR2NklpZDJNZw?oc=5,2025-09-24 09:30:01,"""plastic recycling"" - Google News",2025-09-24 09:30:01+00:00
Europe’s first offshore CO2 carrier receives final outfitting - gasworld,https://news.google.com/rss/articles/CBMirAFBVV95cUxNZ3JtemcyQ0ZJZ3MxTVNWUDRmOTY5elp2Yk9UdS1TV2s0N0NNN0RmX1dTNDBCTXNRWDJjR1B5WnYzalgtZnlmXzhhSk10c3k0SEU5c3pqMFFJakNxajJmMGlJWXZFT3lZR1dJbURtX0I5elNzcU1zaFRPeWFnU2N3bkZZMExwME9OdnR0RHB4SEF6bFpuSFV0S2Q3SmdNcmFYZ3ZPRzNlY1NVMWdR?oc=5,2025-09-24 10:20:35,"""carbon capture OR CO2 storage"" - Google News",2025-09-24 10:20:35+00:00
Report: CCU will become 'missed opportunity' without stronger policy support - BusinessGreen,https://news.google.com/rss/articles/CBMinAFBVV95cUxNN0RIMHVRcVV0T0kxMzRLUmN6NmV0TlV1Q1VmZG4zckhmLVU4aUZMS25tQ1VNY2swYmdfNll3U2RDRm15bUx6NFU4MzdJdENQLVFYZ0NiNGJ6VDJXUDZ0NzZuNm1kZmdtVTFFX3U1eTQ3S1Q3eWw1ZTlxYzdSc2EzSFZDNDJ2Um01NmZ6TmdOcjc2OF9EZ3A2c0dfR3Q?oc=5,2025-09-24 10:38:17,"""CCUS"" - Google News",2025-09-24 10:38:17+00:00
Barclays Bets On UNDO For Its First Major CDR Agreement,https://carbonherald.com/barclays-bets-on-undo-for-its-first-major-cdr-agreement/?utm_source=rss&utm_medium=rss&utm_campaign=barclays-bets-on-undo-for-its-first-major-cdr-agreement,2025-09-24 10:52:08,Carbon Herald,2025-09-24 10:52:08+00:00
Prevented Ocean Plastic unveils food-safe recycled polypropylene - Packaging Gateway,https://news.google.com/rss/articles/CBMijwFBVV95cUxQbFQ5N1ZyUGotM0tJelBvS1U0QllPdVFLaFpReTFkLXQzLS1aRHl6aEpYOUkzOEJUMWZxY0xWV2FPOW5IUExnU19pNUZkN21CQW9XM1JRMkYweS1tYzJpZHk0a2I3eVJkWTZfOENtT2w2Q2xPOG9LTWUwTkdOdi1Jd0FzNmdFYXdCSVhudjdjUQ?oc=5,2025-09-24 10:52:30,"""plastic recycling"" - Google News",2025-09-24 10:52:30+00:00
"Thousands of quakes struck a major Greek volcano, mapping the plumbing beneath it",https://www.science.org/content/article/thousands-quakes-struck-major-greek-volcano-mapping-plumbing-beneath-it,2025-09-24 11:00:00,Latest News from Science Magazine,2025-09-24 11:00:00+00:00
Hybrid flow cell system improves CO₂ direct air capture technology - Tech Xplore,https://news.google.com/rss/articles/CBMigAFBVV95cUxPelNYYTgzcDJIM3VIcDMyY1NuMHBYUmY1QmxHTmhJbUhQX1owUnhCMm9oUkl0M0VCM1JlWjVIWWVYbFRLLXFlbDRnWU91aHk2clo0S011aERuVnl3cXFFRnQtaUpfdzI0TlhHc1BBeXVrRVkwSHpDZlc2WS1xd3lnTA?oc=5,2025-09-24 11:00:03,"""direct air capture"" - Google News",2025-09-24 11:00:03+00:00
[ASAP] Strong Electric Fields on Water Microdroplets Enable Near-Unity Selectivity in H2O2 Photosynthesis,http://dx.doi.org/10.1021/jacs.5c06077,2025-09-24 11:48:39,Journal of the American Chemical Society: Latest Articles (ACS Publications),2025-09-24 11:48:39+00:00
Man arrested in connection with cyber-attack on airports,https://www.bbc.com/news/articles/c62ldxyj431o?at_medium=RSS&at_campaign=rss,2025-09-24 11:53:42,BBC News,2025-09-24 11:53:42+00:00
by geoLOGIC | News | New Training Program Shapes The Future Of Canada’s CCUS Workforce - DOB Energy,https://news.google.com/rss/articles/CBMilgFBVV95cUxQZWFRU2JOZXpEQm0xRUJXSnZwc2FKVVJpSUpOX1VtNmFmY3M2c253UndQU0IyWjBCTmJsMVNwWF85SDl1XzZ5UlhGQlZwRGswNnZ5eFBoTFZ0S0hmY2V1bkV2dmx3blpIZi1EamVuYW1ScWRWblZPTFJmSmpidG5VWUVmeEpIeXBINlNtUllXNEd0YzFSZ1E?oc=5,2025-09-24 12:00:35,"""CCUS"" - Google News",2025-09-24 12:00:35+00:00
[ASAP] Heterojunction-Coated Graphite Anode Enables Fast Charging via Built-In Electric Field-Regulated Interfacial Li-Ion Transport,http://dx.doi.org/10.1021/acsenergylett.5c02653,2025-09-24 12:02:04,ACS Energy Letters: Latest Articles (ACS Publications),2025-09-24 12:02:04+00:00
[ASAP] Dual-Site Cobalt-Doped RuO2/TiO2 Electrocatalyst Enables Stable and Cost-Efficient Acidic Oxygen Evolution for PEM Water Electrolysis,http://dx.doi.org/10.1021/jacs.5c14137,2025-09-24 12:04:22,Journal of the American Chemical Society: Latest Articles (ACS Publications),2025-09-24 12:04:22+00:00
[ASAP] Selective Toluene Electrooxidation to Benzyl Alcohol,http://dx.doi.org/10.1021/jacs.5c05986,2025-09-24 12:12:11,Journal of the American Chemical Society: Latest Articles (ACS Publications),2025-09-24 12:12:11+00:00
[ASAP] Quadrupolar Ligand-to-Metal Charge Transfer Excited States in Octahedral Zr(IV) Complexes,http://dx.doi.org/10.1021/jacs.5c10403,2025-09-24 12:12:36,Journal of the American Chemical Society: Latest Articles (ACS Publications),2025-09-24 12:12:36+00:00
[ASAP] Growth of Tin Halide Perovskite Film on Two-Dimensional Hexagonal Boron Nitride via Thermal Evaporation,http://dx.doi.org/10.1021/acsenergylett.5c02309,2025-09-24 12:19:09,ACS Energy Letters: Latest Articles (ACS Publications),2025-09-24 12:19:09+00:00
Storied atom-smasher that makes tiny Big Bangs wraps up mission,https://www.science.org/content/article/storied-atom-smasher-makes-tiny-big-bangs-wraps-mission,2025-09-24 12:20:24,Latest News from Science Magazine,2025-09-24 12:20:24+00:00
Aircapture Launches First Commercial DAC System In Japan,https://carbonherald.com/aircapture-launches-first-commercial-dac-system-in-japan/?utm_source=rss&utm_medium=rss&utm_campaign=aircapture-launches-first-commercial-dac-system-in-japan,2025-09-24 12:39:58,Carbon Herald,2025-09-24 12:39:58+00:00
Direct Air Capture Market: Transforming Carbon Removal for a Net-Zero Future - openPR.com,https://news.google.com/rss/articles/CBMimAFBVV95cUxNcFZpeV93Nk1OQkY4RWNIYmFDNDk3bVYzbTR5TEVxWHVvTVpNdjR1QnVpajNpNmhHOFlqcXQ3SHBiUkkzdEtmV0lKMlZDczExVlBLQzUxR09qY3hSYzc1RnlEYWlvUkJINkNoQUxEc1B2TV9sTVd3aHU1dWlvMGpCVmRVcUY0VU5DVzhFekpUUG1FaU5kaF9Oaw?oc=5,2025-09-24 12:46:29,"""direct air capture"" - Google News",2025-09-24 12:46:29+00:00
Maritime Decarbonization: Japanese Shipping Giant NYK Partners with 1PointFive for DAC Credits - CarbonCredits.com,https://news.google.com/rss/articles/CBMivAFBVV95cUxPaGMyRWRLal9Gc01wcU1XOWRvdTBzdWxublRqUy1pWnBVSXhCU25GME4xTVVPdzNoSlhCSTF3RnlJbFlfM0VHdmNXdDhlTkpucnhWSUl6MUoxWDhfTk53NXdNVlQ2TklhOFZOSHhUd05VV3JNZndaWUltMG5CRWdtZzUwT1NPT2I2dEFNMFBydlJkaDZnZWJjRHJqalBQTm85TjA5OTI5RjQ5aDhZU0syRmRKVjRtblBubEYtbQ?oc=5,2025-09-24 13:00:11,"""direct air capture"" - Google News",2025-09-24 13:00:11+00:00
GE Vernova : to deploy pioneering Direct Air Capture technology at Deep Sky Alpha in Canada - MarketScreener,https://news.google.com/rss/articles/CBMi2gFBVV95cUxQZGFEeWk0N0RnZEYtY05KSFdxdi1EblZRaTN6UXVqMGdLbFI0bGpzMzcweDRsaEp6S3NJQTlIN3RXQVY2QkVrNDhTcXhyUXNjcnRnQVUwYXBmaHFTdHRaNXc5YnNWMW1hVnJGOVZzSm5RVVJ4bEtvdml2dkFhOFZ3Z1NVWE04N3JVdzBnQVBzT1FtOE5XemNuQjNDTkM2eGR5a1dFT21ScTduN01NR2wwbDBWeWxQTVhtc3phM2JtbmVJemdVZXdkY1FodUtBcHBvb2lXb21BVzVoUQ?oc=5,2025-09-24 13:16:07,"""direct air capture"" - Google News",2025-09-24 13:16:07+00:00
GE Vernova To Install DAC Tech At Deep Sky Alpha,https://carbonherald.com/ge-vernova-to-install-dac-tech-at-deep-sky-alpha/?utm_source=rss&utm_medium=rss&utm_campaign=ge-vernova-to-install-dac-tech-at-deep-sky-alpha,2025-09-24 13:33:04,Carbon Herald,2025-09-24 13:33:04+00:00
GE Vernova To Install DAC Tech At Deep Sky Alpha - Carbon Herald,https://news.google.com/rss/articles/CBMif0FVX3lxTE54OHFCTXk0amUtbll2ZzJvZEcxanNBX08xaHBOM3RhQlhsMXBsbl9VVXlDekdNVlBzenpObjdOVjhhTnFIaFFRVkJFNWo2MHQyS0czZkFrdkZYYnRlREZDTWlxUHJpQ1hmdjZENDJRQ01NYjNUYjRULXNDZzIwUWs?oc=5,2025-09-24 13:33:49,"""direct air capture"" - Google News",2025-09-24 13:33:49+00:00
K 2025: Coperion showcases technologies for compounding and recycling - RECYCLING magazine,https://news.google.com/rss/articles/CBMitgFBVV95cUxQd1I4R2otaGFqX2l0R0tEYUNzUjQtdm02MXBpZm12cGE0YTNEbWl1dnBFTzU2a1ZSNFZpMzlmbFFKMkM3Wmh2REp3bElIY3JVaUE3N042ekpMZ3Q4U3VHdGt2dUFXVTlObDdqXzNnTWtzaHJ4a1p3V1dfNmFuTW1fbHpUUVpzWV9fOWR1end4OE12MGI3VF95Nl9HZGFCOHMtckJ5QldKNnVpNzN1X05YVm9sc055UQ?oc=5,2025-09-24 13:38:21,"""plastic recycling"" - Google News",2025-09-24 13:38:21+00:00
Aircapture Launches First Commercial DAC Facility in Japan - Reuters,https://news.google.com/rss/articles/CBMirgFBVV95cUxNZmprOWk4aHBZMW1zQnFOUHVkSFZkdUZzTDBSdVlHOWRkSU5TQVRvWElCY2dYV0VXbk5lWnJta2F6aXRsMHhuZ05FRE9sZEtWWnhXN0RZUmNwb3lRRDNQMXltR1BWS3htQjNRQkRjRzMxMVhYS1h0WU5jbEhySFV6WmJzWnRRYzhBRkxpRk5iR2p2YUFrN01rUTZXb1V6RFlEV2hZRUNEX0o5eF9relE?oc=5,2025-09-24 14:18:48,"""direct air capture"" - Google News",2025-09-24 14:18:48+00:00
WTS Advances Circular Solutions and Sustainable Materials Management - American Chemistry Council,https://news.google.com/rss/articles/CBMi5AFBVV95cUxPVHl4ODJUR0NZZmtVVUQ4d3F0RDVmbVRyT3BOMXVuZW5YdDFVVW1EREEzVi1sUHcxdGh3b3psU3JYcDI0TllJUTZXMFlES2ljQVAwQ0VHM2FpclVWRDhFY2VJczl0aXpjMzdQOExQY09HWlVFTWJ6OV82R21oZndkLVR4STZTNVN0eUViLTZlSjk0X2lKTWxydnhYT1UtSnM0TXQtTzY1SEVEQkhudFRYUGc5R2dwZU92Umt2S2xjWldocjR1UVVrTkU3aWJEdkp3dUlPemRqWDV3a0xmVjRlVl9LWHY?oc=5,2025-09-24 14:26:50,"""plastic recycling"" - Google News",2025-09-24 14:26:50+00:00
GE Vernova to install direct-air carbon-capture unit at Deep Sky site - The Globe and Mail,https://news.google.com/rss/articles/CBMiuwFBVV95cUxNQ000RUVOTXJWeHlIdmlNRkRiX1JFZG5uSDZzQjY3anBkeENKR2NBel91dEh4Sk1VVXhDVTFKdlRYWG5kWWd5RGxvUWtsYkNockpRdVdfUkkwQnFYTldDSlpiVGlaWFVWWmhMbzQzS3Z3eVI0a2NfTDBFRmZvdmZXd255LUhUZlctRlFaMnc5cE1HdFZXZnVYOWo5OG9YZjh1VExDYmc2OVg1VXRZQk5WMDZFclBUYWxsNXI0?oc=5,2025-09-24 14:37:23,"""direct air capture"" - Google News",2025-09-24 14:37:23+00:00
Low Carbon Contracts Company signs first industrial CCUS contracts - Utility Week,https://news.google.com/rss/articles/CBMimAFBVV95cUxQSUVvNzZOOWFmRnJfQTJPMXRvMVhub3JWTzlZNFc0TU1iYWs4QnBzLXZ3OW1MeTgxRDl0ZGQxSXNBRl9XRE1RQlc2bkpHRmZyNEhGNE56ZkJlQnpjTkRQcHduMWNIWV9OemhUU0U1SmliWUJGTTBPeUlFT180bGpPaXA4VEJrdVJObUxQY0gxM0c3TWdJOG9mZdIBpAFBVV95cUxNQjZ4alFDTGJGZWdNbDdHS2VDZ3pOVm9leWQ1NTRULVZPX2JUV2RheGsxd09vUDgxVk9ZMVhNbHV1VnJhQVZ3NVJpYVJDZXBPbUtMZk12ZkloQXlPZ1dYVk92d0M1NWFleFBSLTJJRF9aZ3V0dVNnUWhpTlJfNlBsSHI5MlhfYlVjTm5mS1pxYUs1N3E3bzVxem5abTJZQzJkaGIwaw?oc=5,2025-09-24 15:12:36,"""CCUS"" - Google News",2025-09-24 15:12:36+00:00
Cropped 24 September 2025: High Seas Treaty milestone; ‘Erratic’ water cycle; Family food at COP30,https://www.carbonbrief.org/cropped-24-september-2025-high-seas-treaty-milestone-erratic-water-cycle-family-food-at-cop30/,2025-09-24 15:20:36,Carbon Brief,2025-09-24 15:20:36+00:00
"EfW sector could be carbon negative by 2035, says enfinium - Materials Recycling World",https://news.google.com/rss/articles/CBMinAFBVV95cUxQOHBOLVlEd3ZOLVlxUGlJMjNWWnZPZ043QnBQc2VtVzdQVkx2Rk9ZMmdSMUtRVXh1STdIWTJ2Sy1QM0pKaV9UdlVzQkU2N3J1Q0pxR3JMM2l2V1NQeGxjdjJ3clF5aDJkMDgzV21PclRyYnJ4dzR0ODB1dUFLVjJRR0RCYWljUXhOQ0pIcXEtdl9xQWQzZmZ2aXhNanQ?oc=5,2025-09-24 15:27:07,"""carbon capture OR CO2 storage"" - Google News",2025-09-24 15:27:07+00:00
Germany's recycling system: sorting trash and saving cash - DW,https://news.google.com/rss/articles/CBMiowFBVV95cUxNdldEaUp5ZWUtM3Z0dm1LaklrNHE1TVFsMFl5WTRKaDM5dFFNOWtwalJlaG9xZUROTm1VekZNSS1wYk9qWGdfYzg5eWM0czB1d3JJSGRDeHlJN0JzTDk1Wld6YVBwd1o3UkpBcElOc0Jvb0lvaVZnM2hmZkF5eUxtd0d1emdONU9lVkU4ckotZk1vdlpMT3ViR3Rnd05fRW1nT0xv?oc=5,2025-09-24 15:47:10,"""plastic recycling"" - Google News",2025-09-24 15:47:10+00:00
Low carbon optimization for wind integrated power systems with carbon capture and energy storage under carbon pricing - Nature,https://news.google.com/rss/articles/CBMiX0FVX3lxTE9kdklKV2I4X0JINGlZX1FyWFVtWWoxaFVBWklWcTJkN05XN2txX0RYeThGZHJnX3BYS2VJSkpxTXlaZ1NTZGNYTnlyaHNLVEw5amRSWlJSVWs0a292UVdj?oc=5,2025-09-24 16:03:32,"""carbon capture OR CO2 storage"" - Google News",2025-09-24 16:03:32+00:00
"Deodorant, toothpaste, ice cream tubs: Here are the new items Ontarians will be able to start recycling next year - NOW Toronto",https://news.google.com/rss/articles/CBMipgFBVV95cUxPaXJzUmlpNjcwYlNDWGIyYkxxaTlabkVGN28yVlphWVJfTU1PTktWemgyUllDVXJ0VHgzcTN4c3R5TThCUzVsamdnR0Jwd0d0YjF5QnhSYXA3cWR4SmRHMkxvNUJHTkRUZGlCSWpPVHhmLVVmYVFTUmpjR3Q0azBSdXFMbHo2MUpoQ2pmbUtNMGc0YXJqWmZpYUZUSFd0QmhjalZQZU9R?oc=5,2025-09-24 16:05:07,"""plastic recycling"" - Google News",2025-09-24 16:05:07+00:00
California may file more plastics recycling lawsuits - Plastics News,https://news.google.com/rss/articles/CBMiqwFBVV95cUxPR3pydHpsV1cxWlpPb1M1YTF0aU5feG9pTWxIcDJLSGNEbmdXUTNrX01OU2NuTFJZdjRDcXVOY3FTV0xocG1OZGtUdXFGUkNDWkVaTVNFWlc4S09UNGM2RWRQT3pHckJlX3ZaNTNZNzAwcUFQcXdsMGZlaUVXekpzY0JZQjdFTjl2U2FpeXNjM3plUEt1MDhrNkpPeFBfdzdfVGJfWjNpMU1tUDQ?oc=5,2025-09-24 16:08:33,"""plastic recycling"" - Google News",2025-09-24 16:08:33+00:00
Meet the history-making astronauts headed for the Moon,https://www.bbc.com/news/articles/cvg0kv8rq0xo?at_medium=RSS&at_campaign=rss,2025-09-24 16:20:53,BBC News,2025-09-24 16:20:53+00:00
Why Schneider Electric Invests in Climeworks Carbon Capture - Sustainability Magazine,https://news.google.com/rss/articles/CBMimgFBVV95cUxOMzRDSm9LcUNmWFZJcTdqU2R2dTJhSVp5VkpzTkQyMUhDQVBwMXNJZUhWNlliRE1qeGFTVjNIdFB6a1I2LUxSYzRRWUtwOU4wTEtxSmZLcnJ0ODBSazgzdjdPc2Fpd0dtZXhrSDhtaE5iRlZjVHRWSl9kZjZ3Z0UwTi1JZG9yazdZbmgyZHNjZ0thLU4xXzdZSVFR?oc=5,2025-09-24 16:41:15,"""carbon capture OR CO2 storage"" - Google News",2025-09-24 16:41:15+00:00
"California AG pledges more lawsuits against Trump's green rollbacks, oil companies - Reuters",https://news.google.com/rss/articles/CBMiuAFBVV95cUxQOTQ1QlQ3UEU0V1g2UHpsaVVZOHg0aGtOT3NvLXhXRk1sVldFWC03b3ZJWVlCUFBma2lLaTl3MHZfTHU2a1BjOGdUTklFX0dXOVlUODJ4Z2FZNVBteGRuc3pubG5BaTFKcnZMMm9CbzZMNno1aDRYOXUzbmVMWFVvRGJrQ3ZJTC1jdFZMaW50WENqb3ZnLVBLUEVjdkdYWUhkN1lsTkQzaHNiR2Rra3JoYjZDcjdydUdf?oc=5,2025-09-24 17:26:20,"""plastic recycling"" - Google News",2025-09-24 17:26:20+00:00
How far can EPR drive recycled content uptake? - Waste Dive,https://news.google.com/rss/articles/CBMikwFBVV95cUxOUEdCM1M2V0NNLWhqbnRMeFFNelFtVzU5T2k4ell4S0ZqbFVzMXR4OTlucHZCc1Jqd1VLMlBTd3lJeFdMYVhEV0s3MlVJeXRTWFBHSGtRTTFkbWliR0dpRXNNZFVaWmliSVNnSWVSNDhLSHU5VmFXYTdpYjRqZUlic1ZOajN4MHh3eWhjQjFlRVlWUVU?oc=5,2025-09-24 17:31:49,"""plastic recycling"" - Google News",2025-09-24 17:31:49+00:00
Boise State scientist commercializes breakthrough closed-loop plastic polymer - Boise State University,https://news.google.com/rss/articles/CBMivgFBVV95cUxQYU5CX3QwenpWZXAzM2o0TDFZLVNjV3NlR2l1S2thYnJfdWZuenNNZXB0TERveUFkTnhpbXBoUVpnSFl6RHFQUFZCWWo0T05yVDU3amdydW1WMFlXd2t1dUZiUnNBOEpZSXhZc2hHWnFRU0VabmVYTXEtTFBLZ2tFdXNPN084b3FFM3FhSGxXTE1KRUg0S3VtQUZyVFYtMThxWFpNSnBETE41eUhpYVlZZkFER1pVWFM4dmpOSEpR?oc=5,2025-09-24 18:13:42,"""plastic recycling"" - Google News",2025-09-24 18:13:42+00:00
"2025 Garbage Glam: A Recycling Fashion Show, September 27 - River Cities' Reader",https://news.google.com/rss/articles/CBMifkFVX3lxTE9QQ2xfWVV3Z19HUkthVEpzMGxsTUdXQllkYkozZWREd1JmaEVCU0ozTDhOWTFJTUJrVEV0VFFhRk5FTDVkd19kX2hEZGFVSHptNnpCYXJ3ZUdDUllwYlI3dEM2Z1lZS1J1SXRVNWRmUEdlMkUzczhZUlpiaWFyZw?oc=5,2025-09-24 18:14:27,"""plastic recycling"" - Google News",2025-09-24 18:14:27+00:00
"Gaia Biomaterials, RA International enter compostable plastic alternative distribution agreement - Recycling Today",https://news.google.com/rss/articles/CBMizAFBVV95cUxNRDBIeWhUQ3dYOXlVQ0ZyTlB0TkZQejVzbTNMWndvZnY2cDlFOUYwS1NnRE5BeEtBcmlOUldUd0FJY2J5dndYeFdUdGpaWVUzYzZWV3FMdWhqVEVFMTJHWVdEMjZrdUMwcFhEQzZhQjYycEhITnQ2RlN3cUpZRjRva0tHYUVvQzl3aFRjV0dKV1ZoRmNVTkpYS1ZoaXNjNENjdWtOd0ZyVmQyVU9LTl93eGxOT3VKWWJoYjh5MVlUY05VX2tMOXRhUmhqY2U?oc=5,2025-09-24 18:26:31,"""plastic recycling"" - Google News",2025-09-24 18:26:31+00:00
Japan’s first DAC plant announced - gasworld,https://news.google.com/rss/articles/CBMipAFBVV95cUxQRWJwdGxuSFhxZjNaWEF6WGJjUnVDaGRsRkE4SFdGMHhoYi01NEZubE9qY0xDNHdCTk16dldraFk5NFV1QS1hLUlrZVdqeDM3aWN0Y2djX2RvbzMxRXFMcWxTdkk5ejRBSDZQam9yLXVSM0dBTzdiZnlsdmhIdXhRbEtfZEZ4UmpybkdwMWthTnE0WkxQWkE2Z1lVcFpQQjd4TU5WZw?oc=5,2025-09-24 18:42:07,"""direct air capture"" - Google News",2025-09-24 18:42:07+00:00
Mt. Diablo Resource Recovery announces partnership with Colgate-Palmolive and Glacier robotics for recyclable plastic squeeze tubes - Contra Costa Herald,https://news.google.com/rss/articles/CBMi8wFBVV95cUxOczI2S3pJNTFTbnBvb1dnUW1CMXppaWMtbmktbFVXMlRYWHVGX3hzTTFjclg2TUZ6Q2g5ZlZfWk1PNjBFclltQlloLVBJS0pVamZ3b0FUOXNHQWY0X1BEVWg5clQ2UFREa3NfckhRMS13cFR2dG5iM2E1cnFEUzZpNXdxS2Q1RDk1TG5aMGhhWE9kekV2NXcybU5UX3FBWU5YS2FseDJjdFJORVhWMnRnb0Y0NGJVMVA4Snk5bTQ1VGZZQUlueU0wUldncTN3elBBOEd3VFlIdFQ3cEFQOGNIU0NyMlRsZ0s1bGJQckpTZDh1TXM?oc=5,2025-09-24 18:45:53,"""plastic recycling"" - Google News",2025-09-24 18:45:53+00:00
"Alberta premier talks carbon capture incentive program, waiting for federal legislation - CTV News",https://news.google.com/rss/articles/CBMixgFBVV95cUxOTjRMQkJ0Y1F2QzdjdldWMGZZVEluTDRadmNJUVZkMDNvNFU4czFNM1JKQnRiNW5TOTJtMl9IRjFfLVNSa0w2Y2pWQVlfN2s1UG05UUhaWVZtcV8wM3dOcER0TG9LMVFRZzYyQXI0aHU2WEJYMkNUb3JxMG9ETlNfSS1Tc0NkbGRSRWtRWDN0cWxiblNxM2VLUjZkbE93TjEzbkZERmRrQ1BaN25MeTRqWmV5OWptVlVNS2JJOHFFTTBLUFE4dEE?oc=5,2025-09-24 18:56:48,"""CCUS"" - Google News",2025-09-24 18:56:48+00:00
China makes landmark pledge to cut its climate emissions,https://www.bbc.com/news/articles/cj4y159190go?at_medium=RSS&at_campaign=rss,2025-09-24 18:57:20,BBC News,2025-09-24 18:57:20+00:00
"Wise Expands Carbon Removal Partnership With Opna, Pledges Additional $1.3M",https://carbonherald.com/wise-expands-carbon-removal-partnership-with-opna-pledges-additional-1-3m/?utm_source=rss&utm_medium=rss&utm_campaign=wise-expands-carbon-removal-partnership-with-opna-pledges-additional-1-3m,2025-09-24 19:13:52,Carbon Herald,2025-09-24 19:13:52+00:00
Let us capture your carbon: King’s message to Japan - The Australian,https://news.google.com/rss/articles/CBMimAJBVV95cUxQUlo4YlktdmM2YzJZekFBLV9lbS13c3NvcW9nSWZxN3NMV2YwMC1TSGFOaXJRaWttRU9fV01mcnluVDB2RHdUalowTGZHZ29rR2U1aFpxUzlWRnNKX1JBQmx3a1V1RVFnXzFUZjNtMXFqZEFkSnNQSjB0R25wb0h3ZHFjN0tEeXlHS1FNOWZ1NTY5SjVfcUdIV0tTNnc5VXYxZ2xfWlVoZGM2cDJ6S0tPMml4QnE5MDFybWhGeHpVWkplR21xX0JMSV9lLWg5WEV0M0tjRGxfZHlKTWhGcTVUVWl5OUJnQkhmODF3dDE1bVpKNUVfVjJSVVVEU0NyMUcydzFpdjNkNENSd2pzN3c3YUlEVGZtcDYz0gGeAkFVX3lxTE9UU2ZJZzlYNUI2MENpZFBkMjRfX3UwM21pYmdFQmJqMXcydzcwQnVmQjU4TFUwT1RMeEpzM0lsa0tMN05YWHd2bUF1Y0prZU1OTjN1UHFHdDJqSWIwRFpNREdTQ1hJbWVJQi1KZWlpRXl0TXVZcHF1S0hKaWdTUnFhOTlrV0ZVSktKUVRNdkIwWGUxbUd6alNXbnBkdE9qRFlQaF94QXNsNWtGOGczT0RaOEotZjd0TTlTZ2tQODVaeFgxekRSWlo1MUF1alNNZkhUdjJ3R0UzOTVJcjI3QTFiV0l1czZVNDJvSUpTZEJfQ0pUR1hoVUZSOC1sak1zTVJnM0NIYTB0RmRzaHVtWkhJZ3BTdmMwTFpENXluTkE?oc=5,2025-09-24 19:37:25,"""carbon capture OR CO2 storage"" - Google News",2025-09-24 19:37:25+00:00
First-ever vinyl window recycling program reduces construction waste - Recycling Product News,https://news.google.com/rss/articles/CBMiuwFBVV95cUxPU0ZyUkxKTjVrd3I2VmNSTUNVZFlUYVQwenFRVGttR3d1Q21HTGRzZnpWa3FOTXd4Ui1IaW1BclRsQ0FXSTZqOGpEanRNd3ZSbnJZSW9Cd3E5a013bF9va3k0T3RQeFZRNmRWOVV6SGFfY01UU2J1blR3VkQxdUFqSFZSMzBwOWdDOW15RWZnSWRWVHA4QUxoNEhwMERJRVp2MERQZDhyekd0NjVOeHRYZ0hXcm10Ujh6T3h3?oc=5,2025-09-24 19:59:30,"""plastic recycling"" - Google News",2025-09-24 19:59:30+00:00
Pioneering carbon capture projects ready for construction - GOV.UK,https://news.google.com/rss/articles/CBMilwFBVV95cUxQNS03a21RNmREcUNYRVY4c2JBVlduNGdYUVdLSzBNT3otWlRSdHdvSnBER1praTVFc2dnYzZTYWVGNXhPOEJTM2dnOGwyWWJVYzduWVlRTkgxMWhoNWtnVmN2M3ZTdnk4REw2dGg5SXlYRzJsVkNRcjd1YlUwTXU5ZVlrR09jQ1U0V3Z5a3FhUVgwMGxHV1JN?oc=5,2025-09-24 23:01:00,"""carbon capture OR CO2 storage"" - Google News",2025-09-24 23:01:00+00:00
Could we have cracked one of the world's toughest climate problems? - New Scientist,https://news.google.com/rss/articles/CBMisAFBVV95cUxPOWZteDUyVVpmME94cm0yYTFmRlVBS2MwZXlqU3NER0FiSXFmVllPZ3FmcTN4QWhBSEp6d3B5czktejN3SFoydXRrN2FOQ19rU2s4OS1Yb1RHTUpoczdTSnBVSHNrMW1lUk9WWS0yRVZHU2pjdWxRZ2s4ZFdhN3RwcmN6c0JtWGM3SDY5elp1XzJYY1B6VUxUVUZZaTMtdndldkJaeWdEVXprSm11Mm9rWg?oc=5,2025-09-24 23:01:55,"""carbon capture OR CO2 storage"" - Google News",2025-09-24 23:01:55+00:00
Net Zero Australia reaffirms critical role of gas & CCUS in transition - The National Tribune,https://news.google.com/rss/articles/CBMipwFBVV95cUxNVERwYmt2WmxRRkNEdzhtZk1iUFluUkExMUNrYXlmRklCNEsxVGdBUVpuTkZuUWVzbF9vc09jTC1UWGgyR3gzVGdxUTN2Z2J3VHhZdVpxbEhoSUVqY05ib3p1Z0NPUlhwMVJrdVdwZkxYR2hPamFOSmE2STNMemc4S2FaZTdxNXdwbVpfT2lpY3hkR3VKM3Y3WlJ6cmJrdjgyMUZPWHRVMA?oc=5,2025-09-24 23:08:15,"""CCUS"" - Google News",2025-09-24 23:08:15+00:00
Britain signs deals for carbon capture projects creating 500 jobs - Reuters,https://news.google.com/rss/articles/CBMitwFBVV95cUxOOVNneVFDbVZKamVkZlRpQ2lwbmNQWjFiV1pZMW1IVW1Ua1lXWnBoR0lxLUhrQVp5QkJ6OWVKbXFXcFhyVVVCc3kzdTJYNF9fbVJqQ0FSMElWdFpIQ3JtMXZhX1lJWHgyam5GLVJ1ajZmSzgwbWlFVTFtNE5OLWNBVWNvYW1nWGxBbnFZcS11ZFluZnhKekdCZUNMd2lVSmFQOV8yUnNXYzhDcmVtLWVrUFhDMjdlem8?oc=5,2025-09-24 23:12:02,"""carbon capture OR CO2 storage"" - Google News",2025-09-24 23:12:02+00:00
