title,link,published,source,pub_date
Facilitating analysis and dissemination of proteomics data through metadata integration in MaxQuant,https://www.nature.com/articles/s41467-025-64089-4,2025-09-25 00:00:00,Nature Communications,2025-09-25 00:00:00+00:00
When life gets in the way of your meticulously-planned career in science,https://www.nature.com/articles/d41586-025-02897-w,2025-09-25 00:00:00,Nature,2025-09-25 00:00:00+00:00
Swapping old immune cells in the brain with fresh ones could treat disease,https://www.nature.com/articles/d41586-025-03008-5,2025-09-25 00:00:00,Nature,2025-09-25 00:00:00+00:00
How passage through the Milky Way’s spiral arms altered our planet,https://www.nature.com/articles/d41586-025-03019-2,2025-09-25 00:00:00,Nature,2025-09-25 00:00:00+00:00
Why is autism really on the rise? What the science says,https://www.nature.com/articles/d41586-025-03143-z,2025-09-25 00:00:00,Nature,2025-09-25 00:00:00+00:00
Big mother whales have more daughters than sons,https://www.nature.com/articles/d41586-025-03053-0,2025-09-25 00:00:00,Nature,2025-09-25 00:00:00+00:00
Rewriting lysine reactivity: Lysine-targeted bioconjugation via biomimetic polarity reversal for diversified biomolecule modification,https://www.cell.com/chem/fulltext/S2451-9294(25)00335-3?rss=yes,2025-09-25 00:00:00,Chem,2025-09-25 00:00:00+00:00
US serial killer case opens door to using cutting-edge DNA data in courts,https://www.nature.com/articles/d41586-025-03102-8,2025-09-25 00:00:00,Nature,2025-09-25 00:00:00+00:00
Fish trawling and climate perturbations threaten the largest marine mercury sink,https://www.nature.com/articles/s41893-025-01642-5,2025-09-25 00:00:00,Nature Sustainability,2025-09-25 00:00:00+00:00
Development of clinical immunity to <i>Plasmodium vivax</i> following repeat controlled human malaria infection,https://www.nature.com/articles/s41467-025-63104-y,2025-09-25 00:00:00,Nature Communications,2025-09-25 00:00:00+00:00
Corticonigral projections recruit substantia nigra pars lateralis dopaminergic neurons for auditory threat memories,https://www.nature.com/articles/s41467-025-63132-8,2025-09-25 00:00:00,Nature Communications,2025-09-25 00:00:00+00:00
TEtrimmer: a tool to automate the manual curation of transposable elements,https://www.nature.com/articles/s41467-025-63889-y,2025-09-25 00:00:00,Nature Communications,2025-09-25 00:00:00+00:00
MRAP2 modifies the signaling and oligomerization state of the melanocortin-4 receptor,https://www.nature.com/articles/s41467-025-63988-w,2025-09-25 00:00:00,Nature Communications,2025-09-25 00:00:00+00:00
Enantioselective intramolecular cyclopropanation via a cationic sulfoxonium-Rh-carbene,https://www.nature.com/articles/s41467-025-63694-7,2025-09-25 00:00:00,Nature Communications,2025-09-25 00:00:00+00:00
Advancing sustainable agricultural transformation through the synergy of automated experimental platforms and living labs,https://www.nature.com/articles/s41467-025-64450-7,2025-09-25 00:00:00,Nature Communications,2025-09-25 00:00:00+00:00
One-shot learning for solution operators of partial differential equations,https://www.nature.com/articles/s41467-025-63076-z,2025-09-25 00:00:00,Nature Communications,2025-09-25 00:00:00+00:00
Retractions can reshape scientists’ careers in unexpected ways,https://www.nature.com/articles/d41586-025-02850-x,2025-09-25 00:00:00,Nature,2025-09-25 00:00:00+00:00
Mammoth challenge: why we called our de-extinction company Colossal Biosciences,https://www.nature.com/articles/d41586-025-02668-7,2025-09-25 00:00:00,Nature,2025-09-25 00:00:00+00:00
"Python, the movie! The programming language’s origin story comes to the silver screen",https://www.nature.com/articles/d41586-025-02903-1,2025-09-25 00:00:00,Nature,2025-09-25 00:00:00+00:00
PKM1 is required for embryonic cardiomyocyte proliferation through energetic regulation of NFYa stability,https://academic.oup.com/nsr/advance-article/doi/10.1093/nsr/nwaf408/8263936?rss=1,2025-09-25 00:00:00,National Science Review Advance Access,2025-09-25 00:00:00+00:00
Awaited paradigm shift in marine N2 fixing ecology,https://academic.oup.com/nsr/advance-article/doi/10.1093/nsr/nwaf415/8263917?rss=1,2025-09-25 00:00:00,National Science Review Advance Access,2025-09-25 00:00:00+00:00
Mechanochemical upcycling technologies for sustainable circular fluorine economy,https://www.nature.com/articles/s41557-025-01956-z,2025-09-25 00:00:00,Nature Chemistry,2025-09-25 00:00:00+00:00
A pyridoxal radical carboligase and imine reductase photobiocatalytic cascade for stereoselective synthesis of unnatural prolines,https://www.nature.com/articles/s41557-025-01937-2,2025-09-25 00:00:00,Nature Chemistry,2025-09-25 00:00:00+00:00
Huntington’s disease treated for first time using gene therapy,https://www.nature.com/articles/d41586-025-03139-9,2025-09-25 00:00:00,Nature,2025-09-25 00:00:00+00:00
"Environment Agency failed to visit serious pollution incidents, files show",https://www.bbc.com/news/articles/cy4jk8njpngo?at_medium=RSS&at_campaign=rss,2025-09-25 01:07:14,BBC News,2025-09-25 01:07:14+00:00
"America's blame game over Canada's wildfire smoke misses the point, experts say",https://www.bbc.com/news/articles/cn4l3j93481o?at_medium=RSS&at_campaign=rss,2025-09-25 01:17:33,BBC News,2025-09-25 01:17:33+00:00
How fungus-farming termites control weeds,https://www.science.org/content/article/how-fungus-farming-termites-control-weeds,2025-09-25 02:20:00,Latest News from Science Magazine,2025-09-25 02:20:00+00:00
Researchers are relieved at Trump’s likely pick for National Cancer Institute,https://www.science.org/content/article/researchers-are-relieved-trump-s-likely-pick-national-cancer-institute,2025-09-25 02:23:00,Latest News from Science Magazine,2025-09-25 02:23:00+00:00
Eni's UK plans get boost with go-ahead for carbon capture projects - Upstream Online,https://news.google.com/rss/articles/CBMiwAFBVV95cUxNNXVDVjN0cDBvUEd3OWF3a3RnMWhjdFp4bzZKcDVINVFVQ25jTG0tay1Jb0xpczJaN1E2SUxEMVFmRzByZDJvNFB0VnhJaGNjZ3BUMXQwMzdYbHhNVkc4QzI2R2V0eG5CRVNlNXEzZEk0NkhNOVpVeUhIWmJFM3pHWUJHcE5lWEx1NFYxRWpING9NYVhkVFVMTU9sREszTDZiYTVPSzJENzFLXzBUZDZ1WFAxN1dnRVowMWRWMmpEQ28?oc=5,2025-09-25 02:52:45,"""carbon capture OR CO2 storage"" - Google News",2025-09-25 02:52:45+00:00
Ecuadorian scientists cleared of criminal charges in COVID-19 testing case,https://www.science.org/content/article/ecuadorian-scientists-cleared-criminal-charges-covid-19-testing-case,2025-09-25 05:35:42,Latest News from Science Magazine,2025-09-25 05:35:42+00:00
"Hope, rediscovered",https://www.science.org/doi/abs/10.1126/science.aec4467?af=R,2025-09-25 06:00:05,AAAS: Science: Table of Contents,2025-09-25 06:00:05+00:00
Deazaguanylation is a nucleobase-protein conjugation required for type IV CBASS immunity,https://www.science.org/doi/abs/10.1126/science.adx6053?af=R,2025-09-25 06:00:05,AAAS: Science: Table of Contents,2025-09-25 06:00:05+00:00
Global selection on insect antipredator coloration,https://www.science.org/doi/abs/10.1126/science.adr7368?af=R,2025-09-25 06:00:05,AAAS: Science: Table of Contents,2025-09-25 06:00:05+00:00
Identification of short-range ordering motifs in semiconductors,https://www.science.org/doi/abs/10.1126/science.adu0719?af=R,2025-09-25 06:00:05,AAAS: Science: Table of Contents,2025-09-25 06:00:05+00:00
Fungus-farming termites can protect their crop by confining weeds with fungistatic soil boluses,https://www.science.org/doi/abs/10.1126/science.adr2713?af=R,2025-09-25 06:00:05,AAAS: Science: Table of Contents,2025-09-25 06:00:05+00:00
The phylogenetic position of the Yunxian cranium elucidates the origin of Homo longi and the Denisovans,https://www.science.org/doi/abs/10.1126/science.ado9202?af=R,2025-09-25 06:00:05,AAAS: Science: Table of Contents,2025-09-25 06:00:05+00:00
Lysosomes signal through the epigenome to regulate longevity across generations,https://www.science.org/doi/abs/10.1126/science.adn8754?af=R,2025-09-25 06:00:05,AAAS: Science: Table of Contents,2025-09-25 06:00:05+00:00
What to Expect When You're Dead: An Ancient Tour of Death and the Afterlife,https://www.science.org/doi/abs/10.1126/science.aeb7564?af=R,2025-09-25 06:00:05,AAAS: Science: Table of Contents,2025-09-25 06:00:05+00:00
Why democracies die and what to do next,https://www.science.org/doi/abs/10.1126/science.aea4600?af=R,2025-09-25 06:00:05,AAAS: Science: Table of Contents,2025-09-25 06:00:05+00:00
The vitality of old age,https://www.science.org/doi/abs/10.1126/science.adz7694?af=R,2025-09-25 06:00:05,AAAS: Science: Table of Contents,2025-09-25 06:00:05+00:00
Fiber-imaged supershear dynamics in the 2024 Mw 7 Mendocino Fault earthquake,https://www.science.org/doi/abs/10.1126/science.adx6858?af=R,2025-09-25 06:00:05,AAAS: Science: Table of Contents,2025-09-25 06:00:05+00:00
Quantum learning advantage on a scalable photonic platform,https://www.science.org/doi/abs/10.1126/science.adv2560?af=R,2025-09-25 06:00:05,AAAS: Science: Table of Contents,2025-09-25 06:00:05+00:00
In Other Journals,https://www.science.org/doi/abs/10.1126/science.aec5109?af=R,2025-09-25 06:00:05,AAAS: Science: Table of Contents,2025-09-25 06:00:05+00:00
Critical habitat thresholds for effective pollinator conservation in agricultural landscapes,https://www.science.org/doi/abs/10.1126/science.adr2146?af=R,2025-09-25 06:00:05,AAAS: Science: Table of Contents,2025-09-25 06:00:05+00:00
Buried salt is abetting Arctic thaw,https://www.science.org/doi/abs/10.1126/science.aec5463?af=R,2025-09-25 06:00:05,AAAS: Science: Table of Contents,2025-09-25 06:00:05+00:00
Science’s grim mood colors lighthearted Ig Nobel prizes,https://www.science.org/doi/abs/10.1126/science.aec5466?af=R,2025-09-25 06:00:05,AAAS: Science: Table of Contents,2025-09-25 06:00:05+00:00
Autism initiative embraces little-tested vitamin as a treatment,https://www.science.org/doi/abs/10.1126/science.aec5468?af=R,2025-09-25 06:00:05,AAAS: Science: Table of Contents,2025-09-25 06:00:05+00:00
Understanding avian influenza mortality,https://www.science.org/doi/abs/10.1126/science.adx7159?af=R,2025-09-25 06:00:05,AAAS: Science: Table of Contents,2025-09-25 06:00:05+00:00
NSF held captive,https://www.science.org/doi/abs/10.1126/science.aec5123?af=R,2025-09-25 06:00:05,AAAS: Science: Table of Contents,2025-09-25 06:00:05+00:00
The cosmic time machine on Long Island winds down,https://www.science.org/doi/abs/10.1126/science.aec5469?af=R,2025-09-25 06:00:05,AAAS: Science: Table of Contents,2025-09-25 06:00:05+00:00
Ethicists flirt with AI for reviewing human research,https://www.science.org/doi/abs/10.1126/science.aec5467?af=R,2025-09-25 06:00:05,AAAS: Science: Table of Contents,2025-09-25 06:00:05+00:00
An inheritance of long life,https://www.science.org/doi/abs/10.1126/science.aeb2633?af=R,2025-09-25 06:00:05,AAAS: Science: Table of Contents,2025-09-25 06:00:05+00:00
Researchers customize AI tools at global ‘hackathon’,https://www.science.org/doi/abs/10.1126/science.aec5465?af=R,2025-09-25 06:00:05,AAAS: Science: Table of Contents,2025-09-25 06:00:05+00:00
Op-eds connect scientists and communities,https://www.science.org/doi/abs/10.1126/science.aea8713?af=R,2025-09-25 06:00:05,AAAS: Science: Table of Contents,2025-09-25 06:00:05+00:00
The EPA’s shaken foundation,https://www.science.org/doi/abs/10.1126/science.aec2623?af=R,2025-09-25 06:00:05,AAAS: Science: Table of Contents,2025-09-25 06:00:05+00:00
What if NIH had been 40% smaller?,https://www.science.org/doi/abs/10.1126/science.aeb1564?af=R,2025-09-25 06:00:05,AAAS: Science: Table of Contents,2025-09-25 06:00:05+00:00
Tourism puts Zanzibari reserve at a crossroads,https://www.science.org/doi/abs/10.1126/science.aeb5285?af=R,2025-09-25 06:00:05,AAAS: Science: Table of Contents,2025-09-25 06:00:05+00:00
Retraction,https://www.science.org/doi/abs/10.1126/science.aec1773?af=R,2025-09-25 06:00:05,AAAS: Science: Table of Contents,2025-09-25 06:00:05+00:00
In Science Journals,https://www.science.org/doi/abs/10.1126/science.aec5108?af=R,2025-09-25 06:00:05,AAAS: Science: Table of Contents,2025-09-25 06:00:05+00:00
Corporate tourism threatens protected areas,https://www.science.org/doi/abs/10.1126/science.aeb0953?af=R,2025-09-25 06:00:05,AAAS: Science: Table of Contents,2025-09-25 06:00:05+00:00
Earthquakes in the blind spot,https://www.science.org/doi/abs/10.1126/science.aeb1414?af=R,2025-09-25 06:00:05,AAAS: Science: Table of Contents,2025-09-25 06:00:05+00:00
Gardening strategies of termite farmers,https://www.science.org/doi/abs/10.1126/science.aeb5715?af=R,2025-09-25 06:00:05,AAAS: Science: Table of Contents,2025-09-25 06:00:05+00:00
CCUS: Construction set to begin at two major UK projects - edie.net,https://news.google.com/rss/articles/CBMigwFBVV95cUxPaEkxOUJxdGtJZEY3VmNpNms2MVhSX1lBOXRWeVBxMG9JbmwxUUljT25zaVJCUTVwNy1ZaWJRS2tmdldUR1FCUi1KQVNBVnpRUkk0QnZmc0xGVmktZ25xelYtektVTlQ0Y2JvU2ljd2xFRzA0SGdHWmlXRXVOejY1dkFPTdIBjwFBVV95cUxOUmFOR083c2pfbU1QS2t4R0VPMVpsVDNYODlNV091RFVVNElHN3FuRTd1VnFZNTROWG5oS1IwMC12RTBYZ1EwRmptTWxPVG1SRUlzbUhoYzFHRTZXR2V2V2VnWC1FNzJ1VlVNcEhiUHBvdWszWEZGWXh5bjduMUNGZjYtZlE1UVNqMjdtbjZrQQ?oc=5,2025-09-25 06:36:54,"""CCUS"" - Google News",2025-09-25 06:36:54+00:00
Government backs first full-scale EfW carbon capture project - letsrecycle.com,https://news.google.com/rss/articles/CBMimgFBVV95cUxNSzBvX2pYV0MyOWRDaHFtSmUyVURkaHN0WG0tSDZVWFhZdjlaNFpHTkItQ1ZBZExWeXUwVkJvQWc5N0FoMGhiLU9mNnF5S1dFVHF1OWhHVU0wQU1pNVJCQnFUdGg4cUtuejBxRnRIQ3ptc0VpTUE2Smx2UE9FbUpOUW9OM0tDaTRsTmU0WmRCckttU2NkNGpJSmZB?oc=5,2025-09-25 06:42:16,"""carbon capture OR CO2 storage"" - Google News",2025-09-25 06:42:16+00:00
Instability in the geological regulation of Earth’s climate,https://www.science.org/doi/abs/10.1126/science.adh7730?af=R,2025-09-25 07:00:00,AAAS: Science: Table of Contents,2025-09-25 07:00:00+00:00
Dynamic U2AF cycling defines two phases of cotranscriptional pre-mRNA splicing,https://www.science.org/doi/abs/10.1126/science.adj9141?af=R,2025-09-25 07:00:00,AAAS: Science: Table of Contents,2025-09-25 07:00:00+00:00
From reactive to proactive: Continuous protein monitoring for preventive health care,https://www.science.org/doi/abs/10.1126/science.ady6497?af=R,2025-09-25 07:00:00,AAAS: Science: Table of Contents,2025-09-25 07:00:00+00:00
Dual transposon sequencing profiles the genetic interaction landscape in bacteria,https://www.science.org/doi/abs/10.1126/science.adt7685?af=R,2025-09-25 07:00:00,AAAS: Science: Table of Contents,2025-09-25 07:00:00+00:00
Revealed: Use of heat ‘emergencies’ for rough sleepers hits record in England and Wales,https://www.carbonbrief.org/revealed-use-of-heat-emergencies-for-rough-sleepers-hits-record-in-england-and-wales/,2025-09-25 07:00:00,Carbon Brief,2025-09-25 07:00:00+00:00
Diversity-oriented photobiocatalytic synthesis via stereoselective three-component radical coupling,https://www.science.org/doi/abs/10.1126/science.adx2935?af=R,2025-09-25 07:00:00,AAAS: Science: Table of Contents,2025-09-25 07:00:00+00:00
Erratum for the Report “Fungal small RNAs suppress plant immunity by hijacking host RNA interference pathways” by A. Weinberg et al.,https://www.science.org/doi/abs/10.1126/science.aec0182?af=R,2025-09-25 07:00:00,AAAS: Science: Table of Contents,2025-09-25 07:00:00+00:00
World's largest coal-fired carbon capture project in operation - China Daily,https://news.google.com/rss/articles/CBMifkFVX3lxTE12eFR1ZldmYUpTTkk2RzhBc1dHQzJMTGk5U1FseXdCTV9BTVdVUFJ1SjBJR013bFU5S3gzdU9ZeHdhZzhoYlc2LXZ3X3pzeHRybGwtQWYtZnZQRVEyeGpJa3JkWkt0bWcxOHFYbm1mS0pQZm1Pdk1SX1lXZVpTQQ?oc=5,2025-09-25 07:05:00,"""carbon capture OR CO2 storage"" - Google News",2025-09-25 07:05:00+00:00
World's largest coal-fired carbon capture project in operation - China Daily - Global Edition,https://news.google.com/rss/articles/CBMiggFBVV95cUxNdE1aRV8zNGhIdWZESExGZTBFcjFiOTN0am5iN1Q0dTlzNkMzU1hQVDMxTTFNLXJRUURGZTNDTktxNkRGNzdWbmJGT1FsYlZFel85WGxUY2l2Q3l3dExkMWlSaXR4SVRHOFBTWGNIVjZ2bktNeHVQeHhlMmd6WVpZUEVR?oc=5,2025-09-25 07:15:15,"""CCUS"" - Google News",2025-09-25 07:15:15+00:00
Controversial Cook Islands seabed mining plan gets backing from former Australia PM Scott Morrison - Eco-Business,https://news.google.com/rss/articles/CBMizgFBVV95cUxOZXRmdUxlcm5MYWJ5WERvNk0zOUNVcDRfQTVrbC1fUDZBbVR0UC1LclFOdkZzRUhLQVdoZHptcXY1X2t1Rk5LcjlYbHVuLXpfODJlSkdJbDJkcHgxQUZ4T3ZLaWltdVE1cU9VdHFiWGhlRTJSbEh5RFlUMUxnQ3lzSjR6LXhnQ1NaQUVTTUI1c1dDQmVPQlRPVkN3Mlc1LTd3Rk5qYU1DQXM2Y1dmckt1QkRNcFdrZ3JaV0k5MFNzZHlsSzNSZ1U1NC03VGk4dw?oc=5,2025-09-25 07:42:00,"""deep sea mining"" - Google News",2025-09-25 07:42:00+00:00
HyNet progress as UK-first carbon capture projects greenlit - Energy Voice,https://news.google.com/rss/articles/CBMi0AFBVV95cUxPTG1faFF4czk3OVVGZkU2WlRwRmwtYS1uOXQtQUsySXF1RzdpVTRPYS0teTdKbzRVWUgyZ1ZLSW1aTF93eWU0TjRkWjh6TzZWMGZNOFFnRi1ndHFNSk5hZUhDbkhpNVQ2dWg0YUo3Y1BvSHFtQk5XZ3FIb200NzFMR0FtUndQaTBtNU9DUTBkeTJtN0Jaa1dxaFk0akJMUzBSMktnamw2ZmVqV0txYUNzMWZPMV9TOGpYQUc5Q3AzM0s3RzMyeTQ3LU1ua2pDdUFY?oc=5,2025-09-25 07:50:02,"""carbon capture OR CO2 storage"" - Google News",2025-09-25 07:50:02+00:00
Time to fight against unfair competition and take responsibility - The Parliament Magazine,https://news.google.com/rss/articles/CBMiuAFBVV95cUxNbHJHQnRiZVVjSVE0c3NVMkpzNnctcmQxVTBZc2EtNnZHZVBnYU1Lb1B3UnpNMWhXOXpsbW8weEZ5V0pjSWRjNHFwaDdLZ21JbjcxZTZ5YnFKN1E5NzI4azJabGM4X0h0RkpaaFItbUpleGVKbnd5ZUlXWThKYXg3a1l2eG15Q2FSelNtbGx1M2REWXk3clRESUlnYUlnTEZsTHhITGdBc3Q0b3VLczNEV08wbTh0dHB4?oc=5,2025-09-25 08:10:07,"""plastic recycling"" - Google News",2025-09-25 08:10:07+00:00
GPSC Teams up with Axens to Study DMX Carbon Capture Technology - kaohoon international,https://news.google.com/rss/articles/CBMiakFVX3lxTE9KejBESHVtU3lRazUwblR6Y0k0ZDZ3MkM0Q3dYT19QcUtpX3JxVWhiUHo0SF9IeXV4Z1Q2bDZOZ0l5b1FIaDVrczNSYnczLU5Valg1aHoxNUFWbUVKUU1vY0MtSmpVdXRHUHc?oc=5,2025-09-25 08:17:29,"""carbon capture OR CO2 storage"" - Google News",2025-09-25 08:17:29+00:00
Heidelberg Materials to begin construction of world's first carbon capture cement facility - World Cement,https://news.google.com/rss/articles/CBMi1AFBVV95cUxOVkRjN1I3T0Mzc1VNanlUN2xINTlhOXREVVJqc2FBQzZha0cxdVhoeDZ6MjM3RVBRX0lXWlJMNXJ5UjNMTDZWLVRyYzlCVDJpS1ZRQmprdjFUTWJmbVJwY0hZVmhvSnNwWmFaQUlVaVoxbjZxMXhkdmpOSTFwVFVSVDNHRTFkVmg3OVdjeXlsUmY3WFRPUzFpTmxmcnFWekFXNDlDWnpjcVF5SzRZVGw4VGFMNnNUY09kcVh1WGhCS3EzRHFZaFVKbE1FZy1MQnpVaDBnTQ?oc=5,2025-09-25 08:26:15,"""carbon capture OR CO2 storage"" - Google News",2025-09-25 08:26:15+00:00
What would an Indigenous Law of the Sea look like? - Grist.org,https://news.google.com/rss/articles/CBMioAFBVV95cUxQb3k3cUZ3SFlDc3NRaEp0NnFJQnMwR3hab216UnpuQjA5Zjc5OXoxRzlGeFBrYWRUbnVZUl80ZkI1aE83SnhsdmtoSS13YVZaRUdVYlFVemNOaU1RWi0zZnNyd3ktcnAwdjlLMHRzUmd5alNoMmFVbkViS1VJckxsRW5UdHFxM3l0SU5Gc0NQbldvdmNYYV9JSEdrbWMzcnVP?oc=5,2025-09-25 08:48:45,"""deep sea mining"" - Google News",2025-09-25 08:48:45+00:00
UK Begins Construction Of Two Flagship Carbon Capture Projects,https://carbonherald.com/uk-begins-construction-of-two-flagship-carbon-capture-projects/?utm_source=rss&utm_medium=rss&utm_campaign=uk-begins-construction-of-two-flagship-carbon-capture-projects,2025-09-25 09:13:40,Carbon Herald,2025-09-25 09:13:40+00:00
UK Begins Construction Of Two Flagship Carbon Capture Projects - Carbon Herald,https://news.google.com/rss/articles/CBMikgFBVV95cUxNQUt4Tk9wbm1VZkZQU3dlQWpSNnJTb0ttby0yWVctNFZfY2NTaU0wQWRlUXl3UVlHVnJaTHdveWstNEpuU1FQLVFfN3g2cThLWTNZcmNQMHFCcFJoMTVPR1RSbWhZYS1rd3pOUHRCZUVwTkVaZm1rdVJPZ05qY3B3NUxZQ1RZVDNwV01uVFF3bVFuZw?oc=5,2025-09-25 09:13:55,"""CCUS"" - Google News",2025-09-25 09:13:55+00:00
Two Projects in HyNet CCS Cluster Set to Start Construction - Rigzone,https://news.google.com/rss/articles/CBMitwFBVV95cUxPZjJnVjNMOXZ2U0ROZElES3NkWVFVeUwtRFFXaUNBZEM2SjlGRlpUTGpzRTJCcV81ejRPSjJoQjZjXzZIdHcweDg0S1N6LTl2UmxNSWNLSVV1QnkzMjJLTnc1dDBOU2l2QWd5VHR5eEFMRWpNclNZMkVWc2NsMWdhalJRY3FpNGQ5Z1gtZjJoLVZsakFuTGtoeEhWOWJNcWpTWWJ3ZzdqUkkyUi1JSmQ1NzRDc2lJV28?oc=5,2025-09-25 09:14:00,"""carbon capture OR CO2 storage"" - Google News",2025-09-25 09:14:00+00:00
Nebraska CO2 Pipeline Launches With First-of-Its-Kind Community Fund,https://carbonherald.com/nebraska-co2-pipeline-launches-with-first-of-its-kind-community-fund/?utm_source=rss&utm_medium=rss&utm_campaign=nebraska-co2-pipeline-launches-with-first-of-its-kind-community-fund,2025-09-25 09:37:28,Carbon Herald,2025-09-25 09:37:28+00:00
"Instagram teen accounts still show suicide content, study claims",https://www.bbc.com/news/articles/ce32w7we01eo?at_medium=RSS&at_campaign=rss,2025-09-25 10:03:59,BBC News,2025-09-25 10:03:59+00:00
"Partnership to create food-safe recycled plastic, saving 500m cups from the ocean - letsrecycle.com",https://news.google.com/rss/articles/CBMitAFBVV95cUxOTG5iWlpKNDdhOFJWQWRuN0JHd2NPODdxRllsLUQ2RFY2YU1rcUE1N09vZlU0bnpCbFl5d2RJLVNHV1o1eHUzYVl4WFVNb21BRTBBZng5aVpHZkR6eWJSd09lbXk4b2lsR2RGdWtiNm9oUGJwOGVJcF9tcURJS3YtRzVOUnhXa1dKaXFIMjRWWXJYclFVQUdtNmo4azNQX1NfNDJoUkV3c0ZnaU9lN1J1VFRUMm0?oc=5,2025-09-25 10:04:23,"""plastic recycling"" - Google News",2025-09-25 10:04:23+00:00
WASP launches CUBO HDP with RIGENERA support for on-site plastic recycling - 3D Printing Industry,https://news.google.com/rss/articles/CBMiugFBVV95cUxOMGNHS3NRSHhwTDhvSXRiV05pZVpUN2lGbTRQYnpEVFktOG5zdVlUWE9jSWxTVE03Qkd0ejQtWXh2VU0wRTMyb0N2NzV5NndoUzZGSEFjNXhwSXFUdE1KQW5TeXdSVDk0MFhoU24tZEg5WmtJR2lvNlhHanlvV1liNUhTejZNVllObHJPYzRMZ2FRZlQ1R3lWYXFJTEtYQWJwcWpWN1FxWVgzVWs0YlpVQXFKTXpXWGp3Znc?oc=5,2025-09-25 10:09:06,"""plastic recycling"" - Google News",2025-09-25 10:09:06+00:00
Philly sues Ziploc’s and bread brands’ parent companies over ‘misleading’ recycling symbols - WHYY,https://news.google.com/rss/articles/CBMic0FVX3lxTE0ycWlMTHBnUldvNTNXMkx4NEk1eEs3N0l4UVZ0QkMyV0E5bUJTc2l2Zk5OTnNjaE1iOU9XbzE4OHlacDhSZmNLSDIxRXE4NVV6b0ZBSmpfMDVISjZVa2tVR1Y2QW1RdE1TYVVmbGk4ZE93Z3M?oc=5,2025-09-25 10:18:45,"""plastic recycling"" - Google News",2025-09-25 10:18:45+00:00
Two carbon capture deals signed - Partnerships Bulletin,https://news.google.com/rss/articles/CBMijAFBVV95cUxPYjJVSUpicEpUTFktT3dsc0lYem5pSHAxbk1SXzZGZHA0X0VCdU9uZWtJRl9PdnFKb3FnQUtqZTE0OVU1dDN6cXRzdHRRXzRwMXFpZEY4SlFnSGlzemFVRFJ4Q3czUnFxWEJnQVVkbWxoTVJyOFZVT3pZdDNtb0dTcWJFa1BjdHFaWUdCWg?oc=5,2025-09-25 10:57:00,"""carbon capture OR CO2 storage"" - Google News",2025-09-25 10:57:00+00:00
Sonic the Hedgehog boss on how the series keeps up to speed,https://www.bbc.com/news/articles/cy8ry1vn097o?at_medium=RSS&at_campaign=rss,2025-09-25 11:07:07,BBC News,2025-09-25 11:07:07+00:00
Apple Teams Up With The Conservation Fund On A New Forest Restoration Project In California,https://carbonherald.com/apple-teams-up-with-the-conservation-fund-on-a-new-forest-restoration-project-in-california/?utm_source=rss&utm_medium=rss&utm_campaign=apple-teams-up-with-the-conservation-fund-on-a-new-forest-restoration-project-in-california,2025-09-25 11:31:25,Carbon Herald,2025-09-25 11:31:25+00:00
Two 'world leading' carbon capture projects primed for construction in the UK - IOM3,https://news.google.com/rss/articles/CBMirwFBVV95cUxON2FkdXdDODlzU3g2UEctRHB6X29oZDJNSm1MRmlVZUZzYmg2cE5QYjh5OWNjejlWV2VVd1dONGplZlZjMWFmTW5LRl80VF93cUh1bDRabnBaN0t2Y2UzN01zeHFoSGk3SHJXUWo5MkdtLVQzaEJiMDM4dHBVOUpCbEhoaEtqYUZTUGJxb2psQWd0WVk5SERkZ25Zd0RXZ1h0V2VXNmJwaFFwcndSMkJr?oc=5,2025-09-25 11:44:47,"""carbon capture OR CO2 storage"" - Google News",2025-09-25 11:44:47+00:00
by geoLOGIC | News | New Training Program Shapes The Future Of Canada’s CCUS Workforce - DOB Energy,https://news.google.com/rss/articles/CBMilgFBVV95cUxOR3lrd2ZRcXk2eHNuQ09CcUkyN0t6XzI4cmtwZ2NaV081a2xmUU5hZGROeFVhOGxtU1JzNWxRd2ZsdXBoby1mWUVHNUx2VGlvcG5uNjdUQXQwSUZMc3hLRDlCWXdqMEx3Zm9aQkRSNXVYWTZrUHlVanNVZ05pZ3V6R2I2cXVvLUVkdngxeXhiUVYtWkZKY2c?oc=5,2025-09-25 12:00:12,"""CCUS"" - Google News",2025-09-25 12:00:12+00:00
Indonesia’s Pertamina International Shipping readies to capture CCS/CCUS sweet spot - Offshore-Energy.biz,https://news.google.com/rss/articles/CBMitgFBVV95cUxNSjJ5bWRFS2xsLWdtS2xzYlVON1ozcHlxVDlCRjU0bHk1cllvZ0N4Uk9ZandVVnBJR29RNnBJUnJhWm5qREdPYnJ2VUJUYnB5Qm16MFlMek1CNkkwbDNLN3d1Z0M5a2M0a0NCX2xKRVhFTzZIVUl5WXNxMUw5dkIxUjI5M05hQ2Y4LVUweDd2eVFRVmhjOWpEN2ljVHhxaUZUUWJVNkxCMjN0T0lyMFZkN0VCZGpyUQ?oc=5,2025-09-25 12:42:50,"""CCUS"" - Google News",2025-09-25 12:42:50+00:00
Hudson Board of Health denies Market Basket's ask to continue using non-recyclable plastics - Community Advocate,https://news.google.com/rss/articles/CBMijgJBVV95cUxPaUt6S09nTFd5RkZJejNyTUNXRHdubFhJTVJhR0Z4bkM2a3RobmVBZkRRNlExTnhfOHRFX2UzYkVMNHdfbENCalZ4VXNKTTA4T2hGWlZ0dU1XdkEyWkFYY0lGQUNEVWpsakJmY3ZDTVltQWdHbXBmMlZpWUVNOGoxS1JNV29ZdXVfc20wZWR2SU1nVDRpNnVGNDFQNU9GSXJITXBwd2tnNzg3TzlqcHNKUmVfcU0zc3RPOXhFZ2lVMDktNTdKNDlRR242X0syUVFzS01pSlBWREdXeE5JM3lhRnZxYzF3V2dIdU1jb2pXSktQS2M2Uk1Vd3dvZW5PZENwTXRSZ1dQV2FFSDRSVnc?oc=5,2025-09-25 12:50:00,"""plastic recycling"" - Google News",2025-09-25 12:50:00+00:00
Resynergi Announces Next Phase of Growth - PR Newswire,https://news.google.com/rss/articles/CBMinAFBVV95cUxOZlhEbi00dHp2MWp2dE9Xem5zSmZiYmcxM0VTekREQzlScmR0bUc5MzJTSTl4YnVQNFdMTlpydXVIc2ZZTFVjMXgzRGpWVVh3OW4tZzlVc0NnLVdHcFh2dko1S295TV9VNjNVVy12TE5OZFVUS1FlSHlNLVhLbkxzenRvNktocG1KMDdycGh2QXlZUHh2X2w4bHVIR0s?oc=5,2025-09-25 13:00:00,"""plastic recycling"" - Google News",2025-09-25 13:00:00+00:00
India to Integrate CCUS with Coal Gasification Hubs for Net Zero Transition - Chemical Industry Digest,https://news.google.com/rss/articles/CBMigwFBVV95cUxNb0llUnBXLVNnbjVRcjE0RzVraU15Z25mUnZrbkhocHBwczMyUEdOVENlWThYQ0hYd2tBUWlRNEhWUWY5VFJ5RlIxVzBlUXZGVDVleWJsWFdzcGpDSTdZU1VNN0dISkZnTTMtbWRYR0pmT2J4dlVvNENxVzhBTmpGVmNEYw?oc=5,2025-09-25 13:17:08,"""CCUS"" - Google News",2025-09-25 13:17:08+00:00
