title,link,published,source,pub_date
Carbon capture and storage facility to be built in Ellesmere Port in UK first - Chester Standard,https://news.google.com/rss/articles/CBMingFBVV95cUxOU0s2aHVaR3NMNmctSzNOR2RDQlRUMXBrM1NjekFxUkpKZE9KdzFnRWlwdi01VzdDYm5YMmF3MnFCWDhSdFROaElEdmQwaUtySXVzRVdHa2E4cnJSbHVndkdLc2FSZzFxOUtKdlV6aU1xYTZCQmhHT19QZW1uVlZ3ZnNVU2NsUUNlZlZ2b3JqVF8tdHNPYnlOLUhHeW1sUQ?oc=5,2025-09-25 13:49:08,"""carbon capture OR CO2 storage"" - Google News",2025-09-25 13:49:08+00:00
"Carbon Capture, Utilization, and Storage (CCUS) Markets 2026-2036: Technologies, Market Forecasts, and Players - IDTechEx",https://news.google.com/rss/articles/CBMiogFBVV95cUxQb3pXZDRfY0FnOFB1QkZrWWJKcXd1c2N6V2h3WmpQYjJ4UVozaVQ2OWgxakh2UEIxZEJCWDhxUURBMEhaWnd5NFMxSlAxWm9NdFZ4bndndTZmTTFraVBsUmdNU3BFOENydGN0cV9NN3dEOGF4Q2xDdk1zYWlaekd1WF9DcF81UDFFcllFQ01RUkQ5Y3Zzai1PUkNKWU5KcEhaN0E?oc=5,2025-09-25 14:08:39,"""direct air capture"" - Google News",2025-09-25 14:08:39+00:00
Two ‘world-leading’ carbon capture projects to begin construction - ENDS Report,https://news.google.com/rss/articles/CBMipgFBVV95cUxNcmNBeHY2WHlDSUtYQjJLM1dMSUZ1a2Q0UUFRUkFRV20wbERiN0pYWnFWMmtYZDJhVjQyMk1lMXdrWFJPTlp2cGkzYzdNbUQzZ3EwQ2xyanJTUktnc0YyanUtbVU3UGgwbUlZdXZKMWRiN1Q0a29tN0RHeFlfdjlMcDN2REg5Q1pya1V5ZzZwbDNTQnctWWhrSUhwall5cGZ2VjJVbER3?oc=5,2025-09-25 15:19:27,"""carbon capture OR CO2 storage"" - Google News",2025-09-25 15:19:27+00:00
CCSA And Stakeholders Share Perspectives On Integrating CDR In EU’s ETS,https://carbonherald.com/ccsa-and-stakeholders-share-perspectives-on-integrating-cdr-in-eus-ets/?utm_source=rss&utm_medium=rss&utm_campaign=ccsa-and-stakeholders-share-perspectives-on-integrating-cdr-in-eus-ets,2025-09-25 15:25:12,Carbon Herald,2025-09-25 15:25:12+00:00
NYCW 2025: VCM+ Coalition Sets Ambitious Path For Verified Carbon Market,https://carbonherald.com/nycw-2025-vcm-coalition-sets-ambitious-path-for-verified-carbon-market/?utm_source=rss&utm_medium=rss&utm_campaign=nycw-2025-vcm-coalition-sets-ambitious-path-for-verified-carbon-market,2025-09-25 15:27:28,Carbon Herald,2025-09-25 15:27:28+00:00
Korea Western Power Expands Clean Hydrogen and Carbon Capture - Fuel Cells Works,https://news.google.com/rss/articles/CBMi5gFBVV95cUxPY0ljZkxkQXZLQWxXZ2I3X1hQZDQzZVhrd2txdFhzLUNydFExdzJPbGYtRko5TE1NZ1N4NUwzUEhKUEFCNnVLMFoyU0lMOHhmQ0ItVzRSakJDakhvZktVYnRlZjh4YkgzNWs4WjVySU16VlNlT2JJRVhIdF9mZjhhaS1IdEZtNlpIZkhfc0U3YkM5c0ljWE13Smc5ZGVJZk15VVhobGFqLUtiZFBXNDJYWEZ4NU04eHl2QUcyT01OT0RwRTloU2VxQlhTSzdEQlVGbDVpeGItbGVjUGNQS2tkbU9ESE8yQQ?oc=5,2025-09-25 15:35:00,"""carbon capture OR CO2 storage"" - Google News",2025-09-25 15:35:00+00:00
The Man Who Wants to Mine the Ocean - Macleans.ca,https://news.google.com/rss/articles/CBMia0FVX3lxTE0tcmZMQnlwam93ZmlGSlJKVGdzUTNHYXIzNHJfOW0zZHhQSTVqVmRMVkRpYU9qT05aQzRCRFluX0Ffd2pYcGg4R2JOQzR5RUR2c3NJeEpCSWl6MFZXYlhDdTQ2ekhQUDB0b2VB?oc=5,2025-09-25 15:56:34,"""deep sea mining"" - Google News",2025-09-25 15:56:34+00:00
Q&A: What does China’s new Paris Agreement pledge mean for climate action?,https://www.carbonbrief.org/qa-what-does-chinas-new-paris-agreement-pledge-mean-for-climate-action/,2025-09-25 15:58:03,Carbon Brief,2025-09-25 15:58:03+00:00
BBC Inside Science,https://www.bbc.co.uk/sounds/play/m002jtvm?at_medium=RSS&at_campaign=rss,2025-09-25 16:00:00,BBC News,2025-09-25 16:00:00+00:00
B2B plastic recycling startup Recove raises Rs 5.3 crore in pre-seed round led by Momentum Capital - The Economic Times,https://news.google.com/rss/articles/CBMi-AFBVV95cUxQZzI2TTdjVEVZMEFoazk2b1ZISWFhM0JxUkU0TDBsa3pyRFJfeUhrYUJjTG5nU2dmTkt1MV8xazdkZkRYcnVLS0EwYkFJMW9KMVdHYUlETnRsRWNRV1UydkxBNi13SUFWdzQtSllsVDRBc1dlTXJSX1p6bkxaZUJsX2xPbWg3LVNfUDF6dEVMTWxzVnFIdjJyTjNvY1BCck5VbWRBc2VBYUc2NE5RU2tsQjJoWDNzcURZekhPcFlBeXo2ODF1MjQ0QlVEZE11SzJFSzM4eDNDdDZGeUhjUWpWREFZS0xJUVlmSkxBRmNlTVRzUlRETHE3NtIB_gFBVV95cUxPYTRMSFJzWHY2VDd0OFlueUZXSmdkNDFNZ1pfYzhYejBac2NzRTJBTFBvV3B6a0RxQWVQTGtyS2QtZnJNd1BBY1NLTmhKdFhkQm0wWHVxcUhUVTZ5RHBhUy1QWVdnSkZOOHMxSy1PYWpsbnFwYzVEVkV1S0VBRTQ4Z0RWVTlFSDZiamtlMDdGYjF2dHVPbjA5V21ReGplcnlKWXdNY3p1WmN2X0d4N3pZU0FZS3huVGlGX044aWh5M2lHY3pSMzcyQjVINUdGTkthSlo2LUQ2ajBiMjllRVV6Q01xTUFfTnRXWWlocENGNG9aQ3hQd09jNzJ2UEY2Zw?oc=5,2025-09-25 16:02:58,"""plastic recycling"" - Google News",2025-09-25 16:02:58+00:00
Philadelphia sues CPGs over plastic bag recyclability claims - Packaging Dive,https://news.google.com/rss/articles/CBMivAFBVV95cUxOQlUyY1FaNHJwU0pNdTVYM1lHdUYwN3I1NDBqaUdYblJ5VGlablBFaDcySlFqaVlhdkVIYVZ3c2JXazNfaWFOYnhFM1FfdjlDNS1hRFVxTldaRjFiMTIxbC11M2t0UGs2Sk5EOGhJQWw4TWlUMloxLVBsQkVRRTVjQzZQeTlIM1YzMVBIYnZUeThieFdneTBZNXNIOFhSY2x1REpJNHpteFItM1l3dDdnNWJOMWNRWXY1Z1JKRQ?oc=5,2025-09-25 16:03:10,"""plastic recycling"" - Google News",2025-09-25 16:03:10+00:00
Encyclis signs agreement with government to develop Protos carbon capture project - ENDS Waste & Bioenergy,https://news.google.com/rss/articles/CBMixgFBVV95cUxNV2MzR1pwOHpqNWctYU1ZSzJjOEk2dk5IdUVEQ2ktdkVNOHZxcGZ0V1NJczNjeDZWNUZOaFB6bmNzZUFXMVBxQzR1U1FuQU9wdXZTaURHMjJkdEhLNnpwbGxLRWZmc1RmTlpSVzgtQ2llalIzSy1EN0l2czJtVHJOWGRWY2NnYmJtU0w3QVl6ajVKSDZQMzVlTUtrWnhudTVLaUpfbnlaVXJxWF9URlNycXUxOHM1SENIWGpxampxQ2tjNXozZUE?oc=5,2025-09-25 16:34:33,"""carbon capture OR CO2 storage"" - Google News",2025-09-25 16:34:33+00:00
NYCW 2025: 34 Nations Launch Forest Finance Blueprint At New York Climate Week,https://carbonherald.com/34-nations-launch-forest-finance-blueprint-at-new-york-climate-week/?utm_source=rss&utm_medium=rss&utm_campaign=34-nations-launch-forest-finance-blueprint-at-new-york-climate-week,2025-09-25 16:53:08,Carbon Herald,2025-09-25 16:53:08+00:00
"Children's names, pictures and addresses stolen in nursery chain hack",https://www.bbc.com/news/articles/c62ldyvpwv9o?at_medium=RSS&at_campaign=rss,2025-09-25 17:00:38,BBC News,2025-09-25 17:00:38+00:00
CCUS: The specialist capabilities in the Scottish value chain - Power Technology,https://news.google.com/rss/articles/CBMipwFBVV95cUxNOUJ2WlA4LVBaYWg3SHpraE9EQ0wyYktfbW92eW1lU0ZpcUJSTUdqSllKR2M2V3BQdjJYazhFVERCSGVFcEJ3VjRhRmRLdW5vdkdEOV9JZTVQTDJnX05pLXYwcU1rUkxMbGlkMFRJTEhaQmVfQXBfbF80LWJ6dDJVdnJFTGFPVU5yNTBuNXBCclRtQTJTOVNTRDZsSnpoOXNzazNnM1Q1SQ?oc=5,2025-09-25 17:17:44,"""CCUS"" - Google News",2025-09-25 17:17:44+00:00
"Philadelphia sues Bimbo, Ziploc maker over ‘recyclable' bag claims - Plastics News",https://news.google.com/rss/articles/CBMipwFBVV95cUxPS01ndTY3Y2JIVEpUTVphcVpjNENMQ0Y4YU0xOFZ6QmZOVWwwMjBHZW9fbVdhLUd6M0hlYTJWSVVEOS10U1pic3pEblZMeFUtVjZpMFFCVE1nVjVtRU5sZEVMeVZXZjRmNjFmYUVfdVNyNVZadTJOTU40R1d3RHZQcU5NZVdFYks4RWpKRlBORF9WWnM0a0VLZEhIa1JxaWttNDd6Tk1rVQ?oc=5,2025-09-25 17:45:32,"""plastic recycling"" - Google News",2025-09-25 17:45:32+00:00
Construction begins on CCUS-enabled Protos EfW site - Materials Recycling World,https://news.google.com/rss/articles/CBMilAFBVV95cUxOdGhOcGZlRGhyeWFwbTd6OEYzbWtuU0lMVlFMOXF5d3BzZE5qNTZWMi00bTdPV0xreDh1V0dYX1VTWEI5c0VqOUJJeFFUT3FqZmNqVl8yaU5TbDRvQTRTZ2hmQktNcV91WXNkUV9Zd3FnY1V2ay1wdWZnNmMyUnU1S0x2WmhNNk9CWFJzVTNpTlExcTEw?oc=5,2025-09-25 17:56:09,"""CCUS"" - Google News",2025-09-25 17:56:09+00:00
"Salty permafrost’s role in Arctic melting, the promise of continuous protein monitoring, and death in the ancient world",https://www.science.org/doi/10.1126/science.znsl4xt,2025-09-25 18:00:00,Science Magazine Podcast,2025-09-25 18:00:00+00:00
"Million-year-old skull rewrites human evolution, scientists claim",https://www.bbc.com/news/articles/cdx01ve5151o?at_medium=RSS&at_campaign=rss,2025-09-25 18:03:59,BBC News,2025-09-25 18:03:59+00:00
New plastic recycling facility raises questions over long-term support - belganewsagency.eu,https://news.google.com/rss/articles/CBMiowFBVV95cUxPQWdVZmtSOEZjYzBXaC16dUJ6NHY4Z1Y4MjMxcjQ0TnpoeDJnamQ1QmJwSi1wekdvd0lodFBuazd4T2hIMTJDT2REbHE0UjdMSEFXUENXQS0ta0pTenBJMi1DaGhzRHZKYjNiNHhwOUdBQm4zejQyNnd4WkhYejNSUWlPcDVtaEtPMkdMTldvVDdUdTZPWXRFbjJIdTZXVUVQNmhF?oc=5,2025-09-25 19:03:00,"""plastic recycling"" - Google News",2025-09-25 19:03:00+00:00
[ASAP] Impact of Carbene Ligands on the Properties and Reactivity of Diazoboranes,http://dx.doi.org/10.1021/jacs.5c11090,2025-09-25 19:10:57,Journal of the American Chemical Society: Latest Articles (ACS Publications),2025-09-25 19:10:57+00:00
[ASAP] DNA-Templated Assembly of Metalloprotein Mimics with Hydrolytic Activity,http://dx.doi.org/10.1021/jacs.5c10056,2025-09-25 19:14:18,Journal of the American Chemical Society: Latest Articles (ACS Publications),2025-09-25 19:14:18+00:00
[ASAP] Entropy Governs the Structure and Reactivity of Water Dissociation Under Electric Fields,http://dx.doi.org/10.1021/jacs.5c12397,2025-09-25 19:21:47,Journal of the American Chemical Society: Latest Articles (ACS Publications),2025-09-25 19:21:47+00:00
[ASAP] Identifying Representative Structural Model in Atomically Dispersed Catalysts,http://dx.doi.org/10.1021/jacs.5c09614,2025-09-25 19:33:54,Journal of the American Chemical Society: Latest Articles (ACS Publications),2025-09-25 19:33:54+00:00
"[ASAP] Access to Hybrid Sandwich Complexes of Early Transition Metals with Cp/Cp* and cyclo-E5 Ligands (E = P, As)",http://dx.doi.org/10.1021/jacs.5c11444,2025-09-25 19:34:19,Journal of the American Chemical Society: Latest Articles (ACS Publications),2025-09-25 19:34:19+00:00
[ASAP] Use of Electron-Transfer Mediators to Access Higher Electrochemical Current Densities in Ni-Catalyzed Cross-Electrophile Coupling,http://dx.doi.org/10.1021/jacs.5c10599,2025-09-25 19:37:54,Journal of the American Chemical Society: Latest Articles (ACS Publications),2025-09-25 19:37:54+00:00
[ASAP] Zn2+ Binding Shifts the Conformational Ensemble of α-Synuclein Monomers toward Accelerated Amyloid Formation,http://dx.doi.org/10.1021/jacs.5c11056,2025-09-25 19:45:58,Journal of the American Chemical Society: Latest Articles (ACS Publications),2025-09-25 19:45:58+00:00
[ASAP] Gas–Liquid Decoupling Transport by Self-Draining in the Anode of Anion Exchange Membrane Fuel Cells,http://dx.doi.org/10.1021/jacs.5c11489,2025-09-25 19:46:47,Journal of the American Chemical Society: Latest Articles (ACS Publications),2025-09-25 19:46:47+00:00
Sonoma County plastics recycling startup Resynergi says it is moving out of California - The Press Democrat,https://news.google.com/rss/articles/CBMifkFVX3lxTE5QX3p3YVFSc1ZrS29oYWVpcEFSSF9ZMllfd2h1SkdTQTcxNHhOenhFNm82aWtzZXVVQnE5dzVZN2dTcHhTOE9ncmtnRjB6RHA4bDBDSGRsVTQ4RjNkaDNHWDhIVER4aU80aFFKSjdXeVNPTENrTEp6WTZ1aWVEUQ?oc=5,2025-09-25 20:03:45,"""plastic recycling"" - Google News",2025-09-25 20:03:45+00:00
"Trump claims a TikTok deal is done. Who would own it, and how would it work?",https://www.bbc.com/news/articles/clyng762q4eo?at_medium=RSS&at_campaign=rss,2025-09-25 21:52:36,BBC News,2025-09-25 21:52:36+00:00
Microsoft cuts off some services used by Israeli military unit,https://www.bbc.com/news/articles/cvgjx0zve2no?at_medium=RSS&at_campaign=rss,2025-09-25 22:01:15,BBC News,2025-09-25 22:01:15+00:00
Resynergi moving out of California - Recycling Today,https://news.google.com/rss/articles/CBMioAFBVV95cUxPU3I3N2o1MVhLemFNZE5FeDc3U3pXQ2UzXzM2YjNNTkdMTXBTLTYtZklDZkZ0Rmg3dHRJdVh3d0tLQTdfZ1Qzay1sUFBxMDI5S0tFanVyNE5GSmVicVExek5Ib2x2R3VwOTFJUWk5Rlh6SFh6R014VTQ3RDhMdDN6NS12QU1ZSWh6Z09tdHRCSFUwZVhIQmxsbHZQZXdNbm4w?oc=5,2025-09-25 22:27:11,"""plastic recycling"" - Google News",2025-09-25 22:27:11+00:00
Controversial Bay Area recycling startup ‘highly likely’ to leave California - San Francisco Chronicle,https://news.google.com/rss/articles/CBMiowFBVV95cUxOODNSU2R0VGtGMjVwcmw1d1NxclR0b2dfeFk4ME9obkJORHdKcDZPSXZfYlVoWWZkV3RuOVEtTlVId0xnbzNQaENvQl9OeWxhT2Y2OWh6NmlZYkhSc0F4aUR3dDFJQTVVTnZiZUhVR2czczhwdF9DVXVLUEpTTGpIVTBkNDBxRE9HVjN1QnNxak80ZG9OdmxHV2xwVUc5ekRNSU1v?oc=5,2025-09-25 22:45:04,"""plastic recycling"" - Google News",2025-09-25 22:45:04+00:00
The bacteria turning waste plastic into painkillers,https://www.bbc.com/news/articles/c4gvm1kjxxvo?at_medium=RSS&at_campaign=rss,2025-09-25 23:02:06,BBC News,2025-09-25 23:02:06+00:00
Hooray for the High Seas: the Global Ocean Treaty comes to life - greenpeace.org,https://news.google.com/rss/articles/CBMikAFBVV95cUxPSFdkdWI2VXlDd1hSejdSWE5QeXE2RzdhLVMtWVYzeXB3Y3ZIRXVnelBUVkVvRktQbTh3TnMxRlpuaVBfcEtKa2xVT1l0RHI0OFhYQVZoWGloWTRYUjhHLTVJTmFmNklXYTFnMjRVUWwwWnp2bFhNTjFjNUhkMThtVFlXcXdhME40TnhVZnpCeTI?oc=5,2025-09-25 23:44:41,"""deep sea mining"" - Google News",2025-09-25 23:44:41+00:00
Ratmageddon: Why rats are overrunning our cities,https://www.bbc.com/news/articles/c4gvk397j80o?at_medium=RSS&at_campaign=rss,2025-09-25 23:50:34,BBC News,2025-09-25 23:50:34+00:00
